Station,Measurement,Messgrösse,Messwert,Einheit,Retrieved
Bunthaus,02.10.2025 15:30,Chlorophyll Kieselalgen,87.4,µg/l,2025-10-02T16:00:02.460127Z
Bunthaus,02.10.2025 15:30,Chlorophyll (gesamt),139.4,µg/l,2025-10-02T16:00:02.460127Z
Bunthaus,02.10.2025 15:30,Chlorophyll Grünalgen,44.5,µg/l,2025-10-02T16:00:02.460127Z
Bunthaus,02.10.2025 15:50,Sauerstoffsättigung,125.6,%,2025-10-02T16:00:02.460127Z
Bunthaus,02.10.2025 16:00,Trübung,16.2,FNU,2025-10-02T16:00:02.460127Z
Bunthaus,02.10.2025 16:00,Sauerstoffkonzentration,12.9,mg/l,2025-10-02T16:00:02.460127Z
Bunthaus,02.10.2025 16:00,pH-Wert,8.9,ohne,2025-10-02T16:00:02.460127Z
Bunthaus,02.10.2025 16:00,Wassertemperatur,14.2,°C,2025-10-02T16:00:02.460127Z
Blankenese,02.10.2025 16:00,Sauerstoffkonzentration,5.9,mg/l,2025-10-02T16:00:02.521852Z
Blankenese,02.10.2025 16:00,pH-Wert,7.6,ohne,2025-10-02T16:00:02.521852Z
Blankenese,02.10.2025 16:00,Sauerstoffsättigung,60.4,%,2025-10-02T16:00:02.521852Z
Blankenese,02.10.2025 16:00,Wassertemperatur,15.9,°C,2025-10-02T16:00:02.521852Z
Blankenese,02.10.2025 16:00,Trübung,35.5,FNU,2025-10-02T16:00:02.521852Z
Bunthaus,02.10.2025 15:30,Chlorophyll Kieselalgen,87.4,µg/l,2025-10-02T19:00:01.818114Z
Bunthaus,02.10.2025 15:30,Chlorophyll (gesamt),139.4,µg/l,2025-10-02T19:00:01.818114Z
Bunthaus,02.10.2025 15:30,Chlorophyll Grünalgen,44.5,µg/l,2025-10-02T19:00:01.818114Z
Bunthaus,02.10.2025 15:50,Sauerstoffsättigung,125.6,%,2025-10-02T19:00:01.818114Z
Bunthaus,02.10.2025 16:00,Trübung,16.2,FNU,2025-10-02T19:00:01.818114Z
Bunthaus,02.10.2025 16:00,Sauerstoffkonzentration,12.9,mg/l,2025-10-02T19:00:01.818114Z
Bunthaus,02.10.2025 16:00,pH-Wert,8.9,ohne,2025-10-02T19:00:01.818114Z
Bunthaus,02.10.2025 16:00,Wassertemperatur,14.2,°C,2025-10-02T19:00:01.818114Z
Blankenese,02.10.2025 16:00,Sauerstoffkonzentration,5.9,mg/l,2025-10-02T19:00:01.897598Z
Blankenese,02.10.2025 16:00,pH-Wert,7.6,ohne,2025-10-02T19:00:01.897598Z
Blankenese,02.10.2025 16:00,Sauerstoffsättigung,60.4,%,2025-10-02T19:00:01.897598Z
Blankenese,02.10.2025 16:00,Wassertemperatur,15.9,°C,2025-10-02T19:00:01.897598Z
Blankenese,02.10.2025 16:00,Trübung,35.5,FNU,2025-10-02T19:00:01.897598Z
Bunthaus,02.10.2025 15:30,Chlorophyll Kieselalgen,87.4,µg/l,2025-10-02T22:00:01.504064Z
Bunthaus,02.10.2025 15:30,Chlorophyll (gesamt),139.4,µg/l,2025-10-02T22:00:01.504064Z
Bunthaus,02.10.2025 15:30,Chlorophyll Grünalgen,44.5,µg/l,2025-10-02T22:00:01.504064Z
Bunthaus,02.10.2025 15:50,Sauerstoffsättigung,125.6,%,2025-10-02T22:00:01.504064Z
Bunthaus,02.10.2025 16:00,Trübung,16.2,FNU,2025-10-02T22:00:01.504064Z
Bunthaus,02.10.2025 16:00,Sauerstoffkonzentration,12.9,mg/l,2025-10-02T22:00:01.504064Z
Bunthaus,02.10.2025 16:00,pH-Wert,8.9,ohne,2025-10-02T22:00:01.504064Z
Bunthaus,02.10.2025 16:00,Wassertemperatur,14.2,°C,2025-10-02T22:00:01.504064Z
Blankenese,02.10.2025 16:00,Sauerstoffkonzentration,5.9,mg/l,2025-10-02T22:00:01.583274Z
Blankenese,02.10.2025 16:00,pH-Wert,7.6,ohne,2025-10-02T22:00:01.583274Z
Blankenese,02.10.2025 16:00,Sauerstoffsättigung,60.4,%,2025-10-02T22:00:01.583274Z
Blankenese,02.10.2025 16:00,Wassertemperatur,15.9,°C,2025-10-02T22:00:01.583274Z
Blankenese,02.10.2025 16:00,Trübung,35.5,FNU,2025-10-02T22:00:01.583274Z
Bunthaus,02.10.2025 15:30,Chlorophyll Kieselalgen,87.4,µg/l,2025-10-03T01:00:01.587225Z
Bunthaus,02.10.2025 15:30,Chlorophyll (gesamt),139.4,µg/l,2025-10-03T01:00:01.587225Z
Bunthaus,02.10.2025 15:30,Chlorophyll Grünalgen,44.5,µg/l,2025-10-03T01:00:01.587225Z
Bunthaus,02.10.2025 15:50,Sauerstoffsättigung,125.6,%,2025-10-03T01:00:01.587225Z
Bunthaus,02.10.2025 16:00,Trübung,16.2,FNU,2025-10-03T01:00:01.587225Z
Bunthaus,02.10.2025 16:00,Sauerstoffkonzentration,12.9,mg/l,2025-10-03T01:00:01.587225Z
Bunthaus,02.10.2025 16:00,pH-Wert,8.9,ohne,2025-10-03T01:00:01.587225Z
Bunthaus,02.10.2025 16:00,Wassertemperatur,14.2,°C,2025-10-03T01:00:01.587225Z
Blankenese,02.10.2025 16:00,Sauerstoffkonzentration,5.9,mg/l,2025-10-03T01:00:01.660689Z
Blankenese,02.10.2025 16:00,pH-Wert,7.6,ohne,2025-10-03T01:00:01.660689Z
Blankenese,02.10.2025 16:00,Sauerstoffsättigung,60.4,%,2025-10-03T01:00:01.660689Z
Blankenese,02.10.2025 16:00,Wassertemperatur,15.9,°C,2025-10-03T01:00:01.660689Z
Blankenese,02.10.2025 16:00,Trübung,35.5,FNU,2025-10-03T01:00:01.660689Z
Bunthaus,02.10.2025 15:30,Chlorophyll Kieselalgen,87.4,µg/l,2025-10-03T04:00:02.071066Z
Bunthaus,02.10.2025 15:30,Chlorophyll (gesamt),139.4,µg/l,2025-10-03T04:00:02.071066Z
Bunthaus,02.10.2025 15:30,Chlorophyll Grünalgen,44.5,µg/l,2025-10-03T04:00:02.071066Z
Bunthaus,02.10.2025 15:50,Sauerstoffsättigung,125.6,%,2025-10-03T04:00:02.071066Z
Bunthaus,02.10.2025 16:00,Trübung,16.2,FNU,2025-10-03T04:00:02.071066Z
Bunthaus,02.10.2025 16:00,Sauerstoffkonzentration,12.9,mg/l,2025-10-03T04:00:02.071066Z
Bunthaus,02.10.2025 16:00,pH-Wert,8.9,ohne,2025-10-03T04:00:02.071066Z
Bunthaus,02.10.2025 16:00,Wassertemperatur,14.2,°C,2025-10-03T04:00:02.071066Z
Blankenese,02.10.2025 16:00,Sauerstoffkonzentration,5.9,mg/l,2025-10-03T04:00:02.146172Z
Blankenese,02.10.2025 16:00,pH-Wert,7.6,ohne,2025-10-03T04:00:02.146172Z
Blankenese,02.10.2025 16:00,Sauerstoffsättigung,60.4,%,2025-10-03T04:00:02.146172Z
Blankenese,02.10.2025 16:00,Wassertemperatur,15.9,°C,2025-10-03T04:00:02.146172Z
Blankenese,02.10.2025 16:00,Trübung,35.5,FNU,2025-10-03T04:00:02.146172Z
Bunthaus,03.10.2025 06:50,Chlorophyll (gesamt),120.3,µg/l,2025-10-03T07:00:01.477209Z
Bunthaus,03.10.2025 06:50,Sauerstoffsättigung,117.1,%,2025-10-03T07:00:01.477209Z
Bunthaus,03.10.2025 06:50,Chlorophyll Grünalgen,42.0,µg/l,2025-10-03T07:00:01.477209Z
Bunthaus,03.10.2025 06:50,Chlorophyll Kieselalgen,70.3,µg/l,2025-10-03T07:00:01.477209Z
Bunthaus,03.10.2025 07:00,Wassertemperatur,13.9,°C,2025-10-03T07:00:01.477209Z
Bunthaus,03.10.2025 07:00,Sauerstoffkonzentration,12.0,mg/l,2025-10-03T07:00:01.477209Z
Bunthaus,03.10.2025 07:00,Trübung,13.7,FNU,2025-10-03T07:00:01.477209Z
Bunthaus,03.10.2025 07:00,pH-Wert,8.8,ohne,2025-10-03T07:00:01.477209Z
Blankenese,03.10.2025 07:00,Sauerstoffkonzentration,6.0,mg/l,2025-10-03T07:00:01.546367Z
Blankenese,03.10.2025 07:00,Trübung,22.4,FNU,2025-10-03T07:00:01.546367Z
Blankenese,03.10.2025 07:00,Sauerstoffsättigung,60.4,%,2025-10-03T07:00:01.546367Z
Blankenese,03.10.2025 07:00,Wassertemperatur,15.3,°C,2025-10-03T07:00:01.546367Z
Blankenese,03.10.2025 07:00,pH-Wert,7.7,ohne,2025-10-03T07:00:01.546367Z
Bunthaus,03.10.2025 06:50,Chlorophyll (gesamt),120.3,µg/l,2025-10-03T10:00:01.662885Z
Bunthaus,03.10.2025 06:50,Sauerstoffsättigung,117.1,%,2025-10-03T10:00:01.662885Z
Bunthaus,03.10.2025 06:50,Chlorophyll Grünalgen,42.0,µg/l,2025-10-03T10:00:01.662885Z
Bunthaus,03.10.2025 06:50,Chlorophyll Kieselalgen,70.3,µg/l,2025-10-03T10:00:01.662885Z
Bunthaus,03.10.2025 07:00,Wassertemperatur,13.9,°C,2025-10-03T10:00:01.662885Z
Bunthaus,03.10.2025 07:00,Sauerstoffkonzentration,12.0,mg/l,2025-10-03T10:00:01.662885Z
Bunthaus,03.10.2025 07:00,Trübung,13.7,FNU,2025-10-03T10:00:01.662885Z
Bunthaus,03.10.2025 07:00,pH-Wert,8.8,ohne,2025-10-03T10:00:01.662885Z
Blankenese,03.10.2025 07:00,Sauerstoffkonzentration,6.0,mg/l,2025-10-03T10:00:01.732323Z
Blankenese,03.10.2025 07:00,Trübung,22.4,FNU,2025-10-03T10:00:01.732323Z
Blankenese,03.10.2025 07:00,Sauerstoffsättigung,60.4,%,2025-10-03T10:00:01.732323Z
Blankenese,03.10.2025 07:00,Wassertemperatur,15.3,°C,2025-10-03T10:00:01.732323Z
Blankenese,03.10.2025 07:00,pH-Wert,7.7,ohne,2025-10-03T10:00:01.732323Z
Bunthaus,03.10.2025 15:40,Chlorophyll Kieselalgen,74.6,µg/l,2025-10-04T04:01:21.399615Z
Bunthaus,03.10.2025 15:40,Chlorophyll Grünalgen,39.9,µg/l,2025-10-04T04:01:21.399615Z
Bunthaus,03.10.2025 15:40,Chlorophyll (gesamt),122.2,µg/l,2025-10-04T04:01:21.399615Z
Bunthaus,03.10.2025 15:50,Sauerstoffsättigung,122.3,%,2025-10-04T04:01:21.399615Z
Bunthaus,03.10.2025 16:00,Trübung,14.9,FNU,2025-10-04T04:01:21.399615Z
Bunthaus,03.10.2025 16:00,Wassertemperatur,14.0,°C,2025-10-04T04:01:21.399615Z
Bunthaus,03.10.2025 16:00,pH-Wert,8.8,ohne,2025-10-04T04:01:21.399615Z
Bunthaus,03.10.2025 16:00,Sauerstoffkonzentration,12.5,mg/l,2025-10-04T04:01:21.399615Z
Blankenese,03.10.2025 16:00,Trübung,40.9,FNU,2025-10-04T04:01:21.457495Z
Blankenese,03.10.2025 16:00,Sauerstoffkonzentration,6.1,mg/l,2025-10-04T04:01:21.457495Z
Blankenese,03.10.2025 16:00,Sauerstoffsättigung,62.4,%,2025-10-04T04:01:21.457495Z
Blankenese,03.10.2025 16:00,pH-Wert,7.7,ohne,2025-10-04T04:01:21.457495Z
Blankenese,03.10.2025 16:00,Wassertemperatur,15.5,°C,2025-10-04T04:01:21.457495Z
Bunthaus,04.10.2025 06:50,Sauerstoffsättigung,112.2,%,2025-10-04T07:00:16.424881Z
Bunthaus,04.10.2025 07:00,Sauerstoffkonzentration,11.6,mg/l,2025-10-04T07:00:16.424881Z
Bunthaus,04.10.2025 07:00,Wassertemperatur,13.5,°C,2025-10-04T07:00:16.424881Z
Bunthaus,04.10.2025 07:00,Trübung,15.9,FNU,2025-10-04T07:00:16.424881Z
Bunthaus,04.10.2025 07:00,pH-Wert,8.7,ohne,2025-10-04T07:00:16.424881Z
Bunthaus,04.10.2025 07:00,Chlorophyll (gesamt),115.1,µg/l,2025-10-04T07:00:16.424881Z
Bunthaus,04.10.2025 07:00,Chlorophyll Grünalgen,42.6,µg/l,2025-10-04T07:00:16.424881Z
Bunthaus,04.10.2025 07:00,Chlorophyll Kieselalgen,66.0,µg/l,2025-10-04T07:00:16.424881Z
Blankenese,04.10.2025 07:00,Wassertemperatur,15.0,°C,2025-10-04T07:00:16.490501Z
Blankenese,04.10.2025 07:00,pH-Wert,7.7,ohne,2025-10-04T07:00:16.490501Z
Blankenese,04.10.2025 07:00,Sauerstoffkonzentration,6.5,mg/l,2025-10-04T07:00:16.490501Z
Blankenese,04.10.2025 07:00,Sauerstoffsättigung,65.2,%,2025-10-04T07:00:16.490501Z
Blankenese,04.10.2025 07:00,Trübung,20.1,FNU,2025-10-04T07:00:16.490501Z
Bunthaus,05.10.2025 15:50,Chlorophyll (gesamt),43.6,µg/l,2025-10-05T22:00:02.600416Z
Bunthaus,05.10.2025 15:50,Chlorophyll Grünalgen,17.6,µg/l,2025-10-05T22:00:02.600416Z
Bunthaus,05.10.2025 15:50,Sauerstoffsättigung,83.6,%,2025-10-05T22:00:02.600416Z
Bunthaus,05.10.2025 15:50,Chlorophyll Kieselalgen,20.1,µg/l,2025-10-05T22:00:02.600416Z
Bunthaus,05.10.2025 16:00,Sauerstoffkonzentration,8.5,mg/l,2025-10-05T22:00:02.600416Z
Bunthaus,05.10.2025 16:00,Wassertemperatur,14.1,°C,2025-10-05T22:00:02.600416Z
Bunthaus,05.10.2025 16:00,pH-Wert,8.1,ohne,2025-10-05T22:00:02.600416Z
Bunthaus,05.10.2025 16:00,Trübung,22.7,FNU,2025-10-05T22:00:02.600416Z
Blankenese,05.10.2025 16:00,Sauerstoffkonzentration,7.4,mg/l,2025-10-05T22:00:02.754618Z
Blankenese,05.10.2025 16:00,pH-Wert,7.8,ohne,2025-10-05T22:00:02.754618Z
Blankenese,05.10.2025 16:00,Trübung,46.3,FNU,2025-10-05T22:00:02.754618Z
Blankenese,05.10.2025 16:00,Wassertemperatur,14.9,°C,2025-10-05T22:00:02.754618Z
Blankenese,05.10.2025 16:00,Sauerstoffsättigung,73.7,%,2025-10-05T22:00:02.754618Z
Bunthaus,05.10.2025 15:50,Chlorophyll (gesamt),43.6,µg/l,2025-10-06T04:00:02.965133Z
Bunthaus,05.10.2025 15:50,Chlorophyll Grünalgen,17.6,µg/l,2025-10-06T04:00:02.965133Z
Bunthaus,05.10.2025 15:50,Sauerstoffsättigung,83.6,%,2025-10-06T04:00:02.965133Z
Bunthaus,05.10.2025 15:50,Chlorophyll Kieselalgen,20.1,µg/l,2025-10-06T04:00:02.965133Z
Bunthaus,05.10.2025 16:00,Sauerstoffkonzentration,8.5,mg/l,2025-10-06T04:00:02.965133Z
Bunthaus,05.10.2025 16:00,Wassertemperatur,14.1,°C,2025-10-06T04:00:02.965133Z
Bunthaus,05.10.2025 16:00,pH-Wert,8.1,ohne,2025-10-06T04:00:02.965133Z
Bunthaus,05.10.2025 16:00,Trübung,22.7,FNU,2025-10-06T04:00:02.965133Z
Blankenese,05.10.2025 16:00,Sauerstoffkonzentration,7.4,mg/l,2025-10-06T04:00:03.033076Z
Blankenese,05.10.2025 16:00,pH-Wert,7.8,ohne,2025-10-06T04:00:03.033076Z
Blankenese,05.10.2025 16:00,Trübung,46.3,FNU,2025-10-06T04:00:03.033076Z
Blankenese,05.10.2025 16:00,Wassertemperatur,14.9,°C,2025-10-06T04:00:03.033076Z
Blankenese,05.10.2025 16:00,Sauerstoffsättigung,73.7,%,2025-10-06T04:00:03.033076Z
Bunthaus,06.10.2025 06:10,Chlorophyll (gesamt),49.0,µg/l,2025-10-06T07:02:01.926587Z
Bunthaus,06.10.2025 06:10,Chlorophyll Kieselalgen,20.7,µg/l,2025-10-06T07:02:01.926587Z
Bunthaus,06.10.2025 06:10,Chlorophyll Grünalgen,21.9,µg/l,2025-10-06T07:02:01.926587Z
Bunthaus,06.10.2025 06:50,Sauerstoffsättigung,88.9,%,2025-10-06T07:02:01.926587Z
Bunthaus,06.10.2025 07:00,Trübung,15.1,FNU,2025-10-06T07:02:01.926587Z
Bunthaus,06.10.2025 07:00,Wassertemperatur,13.2,°C,2025-10-06T07:02:01.926587Z
Bunthaus,06.10.2025 07:00,Sauerstoffkonzentration,9.4,mg/l,2025-10-06T07:02:01.926587Z
Bunthaus,06.10.2025 07:00,pH-Wert,8.4,ohne,2025-10-06T07:02:01.926587Z
Blankenese,06.10.2025 07:00,pH-Wert,7.7,ohne,2025-10-06T07:02:02.001710Z
Blankenese,06.10.2025 07:00,Trübung,70.0,FNU,2025-10-06T07:02:02.001710Z
Blankenese,06.10.2025 07:00,Sauerstoffkonzentration,7.0,mg/l,2025-10-06T07:02:02.001710Z
Blankenese,06.10.2025 07:00,Wassertemperatur,14.6,°C,2025-10-06T07:02:02.001710Z
Blankenese,06.10.2025 07:00,Sauerstoffsättigung,70.0,%,2025-10-06T07:02:02.001710Z
Bunthaus,06.10.2025 06:10,Chlorophyll (gesamt),49.0,µg/l,2025-10-06T09:46:14.784560Z
Bunthaus,06.10.2025 06:10,Chlorophyll Kieselalgen,20.7,µg/l,2025-10-06T09:46:14.784560Z
Bunthaus,06.10.2025 06:10,Chlorophyll Grünalgen,21.9,µg/l,2025-10-06T09:46:14.784560Z
Bunthaus,06.10.2025 06:50,Sauerstoffsättigung,88.9,%,2025-10-06T09:46:14.784560Z
Bunthaus,06.10.2025 07:00,Trübung,15.1,FNU,2025-10-06T09:46:14.784560Z
Bunthaus,06.10.2025 07:00,Wassertemperatur,13.2,°C,2025-10-06T09:46:14.784560Z
Bunthaus,06.10.2025 07:00,Sauerstoffkonzentration,9.4,mg/l,2025-10-06T09:46:14.784560Z
Bunthaus,06.10.2025 07:00,pH-Wert,8.4,ohne,2025-10-06T09:46:14.784560Z
Blankenese,06.10.2025 07:00,pH-Wert,7.7,ohne,2025-10-06T09:46:14.852168Z
Blankenese,06.10.2025 07:00,Trübung,70.0,FNU,2025-10-06T09:46:14.852168Z
Blankenese,06.10.2025 07:00,Sauerstoffkonzentration,7.0,mg/l,2025-10-06T09:46:14.852168Z
Blankenese,06.10.2025 07:00,Wassertemperatur,14.6,°C,2025-10-06T09:46:14.852168Z
Blankenese,06.10.2025 07:00,Sauerstoffsättigung,70.0,%,2025-10-06T09:46:14.852168Z
Bunthaus,06.10.2025 06:10,Chlorophyll (gesamt),49.0,µg/l,2025-10-06T09:46:44.316938Z
Bunthaus,06.10.2025 06:10,Chlorophyll Kieselalgen,20.7,µg/l,2025-10-06T09:46:44.316938Z
Bunthaus,06.10.2025 06:10,Chlorophyll Grünalgen,21.9,µg/l,2025-10-06T09:46:44.316938Z
Bunthaus,06.10.2025 06:50,Sauerstoffsättigung,88.9,%,2025-10-06T09:46:44.316938Z
Bunthaus,06.10.2025 07:00,Trübung,15.1,FNU,2025-10-06T09:46:44.316938Z
Bunthaus,06.10.2025 07:00,Wassertemperatur,13.2,°C,2025-10-06T09:46:44.316938Z
Bunthaus,06.10.2025 07:00,Sauerstoffkonzentration,9.4,mg/l,2025-10-06T09:46:44.316938Z
Bunthaus,06.10.2025 07:00,pH-Wert,8.4,ohne,2025-10-06T09:46:44.316938Z
Blankenese,06.10.2025 07:00,pH-Wert,7.7,ohne,2025-10-06T09:46:44.363639Z
Blankenese,06.10.2025 07:00,Trübung,70.0,FNU,2025-10-06T09:46:44.363639Z
Blankenese,06.10.2025 07:00,Sauerstoffkonzentration,7.0,mg/l,2025-10-06T09:46:44.363639Z
Blankenese,06.10.2025 07:00,Wassertemperatur,14.6,°C,2025-10-06T09:46:44.363639Z
Blankenese,06.10.2025 07:00,Sauerstoffsättigung,70.0,%,2025-10-06T09:46:44.363639Z
Bunthaus,06.10.2025 06:10,Chlorophyll (gesamt),49.0,µg/l,2025-10-06T09:47:01.227667Z
Bunthaus,06.10.2025 06:10,Chlorophyll Kieselalgen,20.7,µg/l,2025-10-06T09:47:01.227667Z
Bunthaus,06.10.2025 06:10,Chlorophyll Grünalgen,21.9,µg/l,2025-10-06T09:47:01.227667Z
Bunthaus,06.10.2025 06:50,Sauerstoffsättigung,88.9,%,2025-10-06T09:47:01.227667Z
Bunthaus,06.10.2025 07:00,Trübung,15.1,FNU,2025-10-06T09:47:01.227667Z
Bunthaus,06.10.2025 07:00,Wassertemperatur,13.2,°C,2025-10-06T09:47:01.227667Z
Bunthaus,06.10.2025 07:00,Sauerstoffkonzentration,9.4,mg/l,2025-10-06T09:47:01.227667Z
Bunthaus,06.10.2025 07:00,pH-Wert,8.4,ohne,2025-10-06T09:47:01.227667Z
Blankenese,06.10.2025 07:00,pH-Wert,7.7,ohne,2025-10-06T09:47:01.298749Z
Blankenese,06.10.2025 07:00,Trübung,70.0,FNU,2025-10-06T09:47:01.298749Z
Blankenese,06.10.2025 07:00,Sauerstoffkonzentration,7.0,mg/l,2025-10-06T09:47:01.298749Z
Blankenese,06.10.2025 07:00,Wassertemperatur,14.6,°C,2025-10-06T09:47:01.298749Z
Blankenese,06.10.2025 07:00,Sauerstoffsättigung,70.0,%,2025-10-06T09:47:01.298749Z
Bunthaus,06.10.2025 06:10,Chlorophyll (gesamt),49.0,µg/l,2025-10-06T09:48:01.630002Z
Bunthaus,06.10.2025 06:10,Chlorophyll Kieselalgen,20.7,µg/l,2025-10-06T09:48:01.630002Z
Bunthaus,06.10.2025 06:10,Chlorophyll Grünalgen,21.9,µg/l,2025-10-06T09:48:01.630002Z
Bunthaus,06.10.2025 06:50,Sauerstoffsättigung,88.9,%,2025-10-06T09:48:01.630002Z
Bunthaus,06.10.2025 07:00,Trübung,15.1,FNU,2025-10-06T09:48:01.630002Z
Bunthaus,06.10.2025 07:00,Wassertemperatur,13.2,°C,2025-10-06T09:48:01.630002Z
Bunthaus,06.10.2025 07:00,Sauerstoffkonzentration,9.4,mg/l,2025-10-06T09:48:01.630002Z
Bunthaus,06.10.2025 07:00,pH-Wert,8.4,ohne,2025-10-06T09:48:01.630002Z
Blankenese,06.10.2025 07:00,pH-Wert,7.7,ohne,2025-10-06T09:48:01.691652Z
Blankenese,06.10.2025 07:00,Trübung,70.0,FNU,2025-10-06T09:48:01.691652Z
Blankenese,06.10.2025 07:00,Sauerstoffkonzentration,7.0,mg/l,2025-10-06T09:48:01.691652Z
Blankenese,06.10.2025 07:00,Wassertemperatur,14.6,°C,2025-10-06T09:48:01.691652Z
Blankenese,06.10.2025 07:00,Sauerstoffsättigung,70.0,%,2025-10-06T09:48:01.691652Z
Bunthaus,06.10.2025 06:10,Chlorophyll (gesamt),49.0,µg/l,2025-10-06T09:49:02.038911Z
Bunthaus,06.10.2025 06:10,Chlorophyll Kieselalgen,20.7,µg/l,2025-10-06T09:49:02.038911Z
Bunthaus,06.10.2025 06:10,Chlorophyll Grünalgen,21.9,µg/l,2025-10-06T09:49:02.038911Z
Bunthaus,06.10.2025 06:50,Sauerstoffsättigung,88.9,%,2025-10-06T09:49:02.038911Z
Bunthaus,06.10.2025 07:00,Trübung,15.1,FNU,2025-10-06T09:49:02.038911Z
Bunthaus,06.10.2025 07:00,Wassertemperatur,13.2,°C,2025-10-06T09:49:02.038911Z
Bunthaus,06.10.2025 07:00,Sauerstoffkonzentration,9.4,mg/l,2025-10-06T09:49:02.038911Z
Bunthaus,06.10.2025 07:00,pH-Wert,8.4,ohne,2025-10-06T09:49:02.038911Z
Blankenese,06.10.2025 07:00,pH-Wert,7.7,ohne,2025-10-06T09:49:02.122512Z
Blankenese,06.10.2025 07:00,Trübung,70.0,FNU,2025-10-06T09:49:02.122512Z
Blankenese,06.10.2025 07:00,Sauerstoffkonzentration,7.0,mg/l,2025-10-06T09:49:02.122512Z
Blankenese,06.10.2025 07:00,Wassertemperatur,14.6,°C,2025-10-06T09:49:02.122512Z
Blankenese,06.10.2025 07:00,Sauerstoffsättigung,70.0,%,2025-10-06T09:49:02.122512Z
Bunthaus,06.10.2025 06:10,Chlorophyll (gesamt),49.0,µg/l,2025-10-06T10:00:02.002795Z
Bunthaus,06.10.2025 06:10,Chlorophyll Kieselalgen,20.7,µg/l,2025-10-06T10:00:02.002795Z
Bunthaus,06.10.2025 06:10,Chlorophyll Grünalgen,21.9,µg/l,2025-10-06T10:00:02.002795Z
Bunthaus,06.10.2025 06:50,Sauerstoffsättigung,88.9,%,2025-10-06T10:00:02.002795Z
Bunthaus,06.10.2025 07:00,Trübung,15.1,FNU,2025-10-06T10:00:02.002795Z
Bunthaus,06.10.2025 07:00,Wassertemperatur,13.2,°C,2025-10-06T10:00:02.002795Z
Bunthaus,06.10.2025 07:00,Sauerstoffkonzentration,9.4,mg/l,2025-10-06T10:00:02.002795Z
Bunthaus,06.10.2025 07:00,pH-Wert,8.4,ohne,2025-10-06T10:00:02.002795Z
Blankenese,06.10.2025 07:00,pH-Wert,7.7,ohne,2025-10-06T10:00:02.088180Z
Blankenese,06.10.2025 07:00,Trübung,70.0,FNU,2025-10-06T10:00:02.088180Z
Blankenese,06.10.2025 07:00,Sauerstoffkonzentration,7.0,mg/l,2025-10-06T10:00:02.088180Z
Blankenese,06.10.2025 07:00,Wassertemperatur,14.6,°C,2025-10-06T10:00:02.088180Z
Blankenese,06.10.2025 07:00,Sauerstoffsättigung,70.0,%,2025-10-06T10:00:02.088180Z
Bunthaus,06.10.2025 06:10,Chlorophyll (gesamt),49.0,µg/l,2025-10-06T10:01:01.367722Z
Bunthaus,06.10.2025 06:10,Chlorophyll Kieselalgen,20.7,µg/l,2025-10-06T10:01:01.367722Z
Bunthaus,06.10.2025 06:10,Chlorophyll Grünalgen,21.9,µg/l,2025-10-06T10:01:01.367722Z
Bunthaus,06.10.2025 06:50,Sauerstoffsättigung,88.9,%,2025-10-06T10:01:01.367722Z
Bunthaus,06.10.2025 07:00,Trübung,15.1,FNU,2025-10-06T10:01:01.367722Z
Bunthaus,06.10.2025 07:00,Wassertemperatur,13.2,°C,2025-10-06T10:01:01.367722Z
Bunthaus,06.10.2025 07:00,Sauerstoffkonzentration,9.4,mg/l,2025-10-06T10:01:01.367722Z
Bunthaus,06.10.2025 07:00,pH-Wert,8.4,ohne,2025-10-06T10:01:01.367722Z
Blankenese,06.10.2025 07:00,pH-Wert,7.7,ohne,2025-10-06T10:01:01.427958Z
Blankenese,06.10.2025 07:00,Trübung,70.0,FNU,2025-10-06T10:01:01.427958Z
Blankenese,06.10.2025 07:00,Sauerstoffkonzentration,7.0,mg/l,2025-10-06T10:01:01.427958Z
Blankenese,06.10.2025 07:00,Wassertemperatur,14.6,°C,2025-10-06T10:01:01.427958Z
Blankenese,06.10.2025 07:00,Sauerstoffsättigung,70.0,%,2025-10-06T10:01:01.427958Z
Bunthaus,06.10.2025 06:10,Chlorophyll (gesamt),49.0,µg/l,2025-10-06T10:02:01.955257Z
Bunthaus,06.10.2025 06:10,Chlorophyll Kieselalgen,20.7,µg/l,2025-10-06T10:02:01.955257Z
Bunthaus,06.10.2025 06:10,Chlorophyll Grünalgen,21.9,µg/l,2025-10-06T10:02:01.955257Z
Bunthaus,06.10.2025 06:50,Sauerstoffsättigung,88.9,%,2025-10-06T10:02:01.955257Z
Bunthaus,06.10.2025 07:00,Trübung,15.1,FNU,2025-10-06T10:02:01.955257Z
Bunthaus,06.10.2025 07:00,Wassertemperatur,13.2,°C,2025-10-06T10:02:01.955257Z
Bunthaus,06.10.2025 07:00,Sauerstoffkonzentration,9.4,mg/l,2025-10-06T10:02:01.955257Z
Bunthaus,06.10.2025 07:00,pH-Wert,8.4,ohne,2025-10-06T10:02:01.955257Z
Blankenese,06.10.2025 07:00,pH-Wert,7.7,ohne,2025-10-06T10:02:02.038681Z
Blankenese,06.10.2025 07:00,Trübung,70.0,FNU,2025-10-06T10:02:02.038681Z
Blankenese,06.10.2025 07:00,Sauerstoffkonzentration,7.0,mg/l,2025-10-06T10:02:02.038681Z
Blankenese,06.10.2025 07:00,Wassertemperatur,14.6,°C,2025-10-06T10:02:02.038681Z
Blankenese,06.10.2025 07:00,Sauerstoffsättigung,70.0,%,2025-10-06T10:02:02.038681Z
Bunthaus,06.10.2025 06:10,Chlorophyll (gesamt),49.0,µg/l,2025-10-06T10:03:01.439577Z
Bunthaus,06.10.2025 06:10,Chlorophyll Kieselalgen,20.7,µg/l,2025-10-06T10:03:01.439577Z
Bunthaus,06.10.2025 06:10,Chlorophyll Grünalgen,21.9,µg/l,2025-10-06T10:03:01.439577Z
Bunthaus,06.10.2025 06:50,Sauerstoffsättigung,88.9,%,2025-10-06T10:03:01.439577Z
Bunthaus,06.10.2025 07:00,Trübung,15.1,FNU,2025-10-06T10:03:01.439577Z
Bunthaus,06.10.2025 07:00,Wassertemperatur,13.2,°C,2025-10-06T10:03:01.439577Z
Bunthaus,06.10.2025 07:00,Sauerstoffkonzentration,9.4,mg/l,2025-10-06T10:03:01.439577Z
Bunthaus,06.10.2025 07:00,pH-Wert,8.4,ohne,2025-10-06T10:03:01.439577Z
Blankenese,06.10.2025 07:00,pH-Wert,7.7,ohne,2025-10-06T10:03:01.502990Z
Blankenese,06.10.2025 07:00,Trübung,70.0,FNU,2025-10-06T10:03:01.502990Z
Blankenese,06.10.2025 07:00,Sauerstoffkonzentration,7.0,mg/l,2025-10-06T10:03:01.502990Z
Blankenese,06.10.2025 07:00,Wassertemperatur,14.6,°C,2025-10-06T10:03:01.502990Z
Blankenese,06.10.2025 07:00,Sauerstoffsättigung,70.0,%,2025-10-06T10:03:01.502990Z
Bunthaus,06.10.2025 06:10,Chlorophyll (gesamt),49.0,µg/l,2025-10-06T10:04:01.886192Z
Bunthaus,06.10.2025 06:10,Chlorophyll Kieselalgen,20.7,µg/l,2025-10-06T10:04:01.886192Z
Bunthaus,06.10.2025 06:10,Chlorophyll Grünalgen,21.9,µg/l,2025-10-06T10:04:01.886192Z
Bunthaus,06.10.2025 06:50,Sauerstoffsättigung,88.9,%,2025-10-06T10:04:01.886192Z
Bunthaus,06.10.2025 07:00,Trübung,15.1,FNU,2025-10-06T10:04:01.886192Z
Bunthaus,06.10.2025 07:00,Wassertemperatur,13.2,°C,2025-10-06T10:04:01.886192Z
Bunthaus,06.10.2025 07:00,Sauerstoffkonzentration,9.4,mg/l,2025-10-06T10:04:01.886192Z
Bunthaus,06.10.2025 07:00,pH-Wert,8.4,ohne,2025-10-06T10:04:01.886192Z
Blankenese,06.10.2025 07:00,pH-Wert,7.7,ohne,2025-10-06T10:04:01.950800Z
Blankenese,06.10.2025 07:00,Trübung,70.0,FNU,2025-10-06T10:04:01.950800Z
Blankenese,06.10.2025 07:00,Sauerstoffkonzentration,7.0,mg/l,2025-10-06T10:04:01.950800Z
Blankenese,06.10.2025 07:00,Wassertemperatur,14.6,°C,2025-10-06T10:04:01.950800Z
Blankenese,06.10.2025 07:00,Sauerstoffsättigung,70.0,%,2025-10-06T10:04:01.950800Z
Bunthaus,06.10.2025 06:10,Chlorophyll (gesamt),49.0,µg/l,2025-10-06T10:05:01.308117Z
Bunthaus,06.10.2025 06:10,Chlorophyll Kieselalgen,20.7,µg/l,2025-10-06T10:05:01.308117Z
Bunthaus,06.10.2025 06:10,Chlorophyll Grünalgen,21.9,µg/l,2025-10-06T10:05:01.308117Z
Bunthaus,06.10.2025 06:50,Sauerstoffsättigung,88.9,%,2025-10-06T10:05:01.308117Z
Bunthaus,06.10.2025 07:00,Trübung,15.1,FNU,2025-10-06T10:05:01.308117Z
Bunthaus,06.10.2025 07:00,Wassertemperatur,13.2,°C,2025-10-06T10:05:01.308117Z
Bunthaus,06.10.2025 07:00,Sauerstoffkonzentration,9.4,mg/l,2025-10-06T10:05:01.308117Z
Bunthaus,06.10.2025 07:00,pH-Wert,8.4,ohne,2025-10-06T10:05:01.308117Z
Blankenese,06.10.2025 07:00,pH-Wert,7.7,ohne,2025-10-06T10:05:01.372557Z
Blankenese,06.10.2025 07:00,Trübung,70.0,FNU,2025-10-06T10:05:01.372557Z
Blankenese,06.10.2025 07:00,Sauerstoffkonzentration,7.0,mg/l,2025-10-06T10:05:01.372557Z
Blankenese,06.10.2025 07:00,Wassertemperatur,14.6,°C,2025-10-06T10:05:01.372557Z
Blankenese,06.10.2025 07:00,Sauerstoffsättigung,70.0,%,2025-10-06T10:05:01.372557Z
Bunthaus,06.10.2025 06:10,Chlorophyll (gesamt),49.0,µg/l,2025-10-06T10:06:01.722942Z
Bunthaus,06.10.2025 06:10,Chlorophyll Kieselalgen,20.7,µg/l,2025-10-06T10:06:01.722942Z
Bunthaus,06.10.2025 06:10,Chlorophyll Grünalgen,21.9,µg/l,2025-10-06T10:06:01.722942Z
Bunthaus,06.10.2025 06:50,Sauerstoffsättigung,88.9,%,2025-10-06T10:06:01.722942Z
Bunthaus,06.10.2025 07:00,Trübung,15.1,FNU,2025-10-06T10:06:01.722942Z
Bunthaus,06.10.2025 07:00,Wassertemperatur,13.2,°C,2025-10-06T10:06:01.722942Z
Bunthaus,06.10.2025 07:00,Sauerstoffkonzentration,9.4,mg/l,2025-10-06T10:06:01.722942Z
Bunthaus,06.10.2025 07:00,pH-Wert,8.4,ohne,2025-10-06T10:06:01.722942Z
Blankenese,06.10.2025 07:00,pH-Wert,7.7,ohne,2025-10-06T10:06:01.784371Z
Blankenese,06.10.2025 07:00,Trübung,70.0,FNU,2025-10-06T10:06:01.784371Z
Blankenese,06.10.2025 07:00,Sauerstoffkonzentration,7.0,mg/l,2025-10-06T10:06:01.784371Z
Blankenese,06.10.2025 07:00,Wassertemperatur,14.6,°C,2025-10-06T10:06:01.784371Z
Blankenese,06.10.2025 07:00,Sauerstoffsättigung,70.0,%,2025-10-06T10:06:01.784371Z
Bunthaus,06.10.2025 06:10,Chlorophyll (gesamt),49.0,µg/l,2025-10-06T10:07:02.286898Z
Bunthaus,06.10.2025 06:10,Chlorophyll Kieselalgen,20.7,µg/l,2025-10-06T10:07:02.286898Z
Bunthaus,06.10.2025 06:10,Chlorophyll Grünalgen,21.9,µg/l,2025-10-06T10:07:02.286898Z
Bunthaus,06.10.2025 06:50,Sauerstoffsättigung,88.9,%,2025-10-06T10:07:02.286898Z
Bunthaus,06.10.2025 07:00,Trübung,15.1,FNU,2025-10-06T10:07:02.286898Z
Bunthaus,06.10.2025 07:00,Wassertemperatur,13.2,°C,2025-10-06T10:07:02.286898Z
Bunthaus,06.10.2025 07:00,Sauerstoffkonzentration,9.4,mg/l,2025-10-06T10:07:02.286898Z
Bunthaus,06.10.2025 07:00,pH-Wert,8.4,ohne,2025-10-06T10:07:02.286898Z
Blankenese,06.10.2025 07:00,pH-Wert,7.7,ohne,2025-10-06T10:07:02.376649Z
Blankenese,06.10.2025 07:00,Trübung,70.0,FNU,2025-10-06T10:07:02.376649Z
Blankenese,06.10.2025 07:00,Sauerstoffkonzentration,7.0,mg/l,2025-10-06T10:07:02.376649Z
Blankenese,06.10.2025 07:00,Wassertemperatur,14.6,°C,2025-10-06T10:07:02.376649Z
Blankenese,06.10.2025 07:00,Sauerstoffsättigung,70.0,%,2025-10-06T10:07:02.376649Z
Bunthaus,06.10.2025 06:10,Chlorophyll (gesamt),49.0,µg/l,2025-10-06T10:08:02.068749Z
Bunthaus,06.10.2025 06:10,Chlorophyll Kieselalgen,20.7,µg/l,2025-10-06T10:08:02.068749Z
Bunthaus,06.10.2025 06:10,Chlorophyll Grünalgen,21.9,µg/l,2025-10-06T10:08:02.068749Z
Bunthaus,06.10.2025 06:50,Sauerstoffsättigung,88.9,%,2025-10-06T10:08:02.068749Z
Bunthaus,06.10.2025 07:00,Trübung,15.1,FNU,2025-10-06T10:08:02.068749Z
Bunthaus,06.10.2025 07:00,Wassertemperatur,13.2,°C,2025-10-06T10:08:02.068749Z
Bunthaus,06.10.2025 07:00,Sauerstoffkonzentration,9.4,mg/l,2025-10-06T10:08:02.068749Z
Bunthaus,06.10.2025 07:00,pH-Wert,8.4,ohne,2025-10-06T10:08:02.068749Z
Blankenese,06.10.2025 07:00,pH-Wert,7.7,ohne,2025-10-06T10:08:02.148372Z
Blankenese,06.10.2025 07:00,Trübung,70.0,FNU,2025-10-06T10:08:02.148372Z
Blankenese,06.10.2025 07:00,Sauerstoffkonzentration,7.0,mg/l,2025-10-06T10:08:02.148372Z
Blankenese,06.10.2025 07:00,Wassertemperatur,14.6,°C,2025-10-06T10:08:02.148372Z
Blankenese,06.10.2025 07:00,Sauerstoffsättigung,70.0,%,2025-10-06T10:08:02.148372Z
Bunthaus,06.10.2025 06:10,Chlorophyll (gesamt),49.0,µg/l,2025-10-06T10:09:02.114175Z
Bunthaus,06.10.2025 06:10,Chlorophyll Kieselalgen,20.7,µg/l,2025-10-06T10:09:02.114175Z
Bunthaus,06.10.2025 06:10,Chlorophyll Grünalgen,21.9,µg/l,2025-10-06T10:09:02.114175Z
Bunthaus,06.10.2025 06:50,Sauerstoffsättigung,88.9,%,2025-10-06T10:09:02.114175Z
Bunthaus,06.10.2025 07:00,Trübung,15.1,FNU,2025-10-06T10:09:02.114175Z
Bunthaus,06.10.2025 07:00,Wassertemperatur,13.2,°C,2025-10-06T10:09:02.114175Z
Bunthaus,06.10.2025 07:00,Sauerstoffkonzentration,9.4,mg/l,2025-10-06T10:09:02.114175Z
Bunthaus,06.10.2025 07:00,pH-Wert,8.4,ohne,2025-10-06T10:09:02.114175Z
Blankenese,06.10.2025 07:00,pH-Wert,7.7,ohne,2025-10-06T10:09:02.183513Z
Blankenese,06.10.2025 07:00,Trübung,70.0,FNU,2025-10-06T10:09:02.183513Z
Blankenese,06.10.2025 07:00,Sauerstoffkonzentration,7.0,mg/l,2025-10-06T10:09:02.183513Z
Blankenese,06.10.2025 07:00,Wassertemperatur,14.6,°C,2025-10-06T10:09:02.183513Z
Blankenese,06.10.2025 07:00,Sauerstoffsättigung,70.0,%,2025-10-06T10:09:02.183513Z
Bunthaus,06.10.2025 06:10,Chlorophyll (gesamt),49.0,µg/l,2025-10-06T10:10:02.079413Z
Bunthaus,06.10.2025 06:10,Chlorophyll Kieselalgen,20.7,µg/l,2025-10-06T10:10:02.079413Z
Bunthaus,06.10.2025 06:10,Chlorophyll Grünalgen,21.9,µg/l,2025-10-06T10:10:02.079413Z
Bunthaus,06.10.2025 06:50,Sauerstoffsättigung,88.9,%,2025-10-06T10:10:02.079413Z
Bunthaus,06.10.2025 07:00,Trübung,15.1,FNU,2025-10-06T10:10:02.079413Z
Bunthaus,06.10.2025 07:00,Wassertemperatur,13.2,°C,2025-10-06T10:10:02.079413Z
Bunthaus,06.10.2025 07:00,Sauerstoffkonzentration,9.4,mg/l,2025-10-06T10:10:02.079413Z
Bunthaus,06.10.2025 07:00,pH-Wert,8.4,ohne,2025-10-06T10:10:02.079413Z
Blankenese,06.10.2025 07:00,pH-Wert,7.7,ohne,2025-10-06T10:10:02.148717Z
Blankenese,06.10.2025 07:00,Trübung,70.0,FNU,2025-10-06T10:10:02.148717Z
Blankenese,06.10.2025 07:00,Sauerstoffkonzentration,7.0,mg/l,2025-10-06T10:10:02.148717Z
Blankenese,06.10.2025 07:00,Wassertemperatur,14.6,°C,2025-10-06T10:10:02.148717Z
Blankenese,06.10.2025 07:00,Sauerstoffsättigung,70.0,%,2025-10-06T10:10:02.148717Z
Bunthaus,06.10.2025 06:10,Chlorophyll (gesamt),49.0,µg/l,2025-10-06T10:11:02.035938Z
Bunthaus,06.10.2025 06:10,Chlorophyll Kieselalgen,20.7,µg/l,2025-10-06T10:11:02.035938Z
Bunthaus,06.10.2025 06:10,Chlorophyll Grünalgen,21.9,µg/l,2025-10-06T10:11:02.035938Z
Bunthaus,06.10.2025 06:50,Sauerstoffsättigung,88.9,%,2025-10-06T10:11:02.035938Z
Bunthaus,06.10.2025 07:00,Trübung,15.1,FNU,2025-10-06T10:11:02.035938Z
Bunthaus,06.10.2025 07:00,Wassertemperatur,13.2,°C,2025-10-06T10:11:02.035938Z
Bunthaus,06.10.2025 07:00,Sauerstoffkonzentration,9.4,mg/l,2025-10-06T10:11:02.035938Z
Bunthaus,06.10.2025 07:00,pH-Wert,8.4,ohne,2025-10-06T10:11:02.035938Z
Blankenese,06.10.2025 07:00,pH-Wert,7.7,ohne,2025-10-06T10:11:02.127226Z
Blankenese,06.10.2025 07:00,Trübung,70.0,FNU,2025-10-06T10:11:02.127226Z
Blankenese,06.10.2025 07:00,Sauerstoffkonzentration,7.0,mg/l,2025-10-06T10:11:02.127226Z
Blankenese,06.10.2025 07:00,Wassertemperatur,14.6,°C,2025-10-06T10:11:02.127226Z
Blankenese,06.10.2025 07:00,Sauerstoffsättigung,70.0,%,2025-10-06T10:11:02.127226Z
Bunthaus,06.10.2025 06:10,Chlorophyll (gesamt),49.0,µg/l,2025-10-06T10:12:01.967203Z
Bunthaus,06.10.2025 06:10,Chlorophyll Kieselalgen,20.7,µg/l,2025-10-06T10:12:01.967203Z
Bunthaus,06.10.2025 06:10,Chlorophyll Grünalgen,21.9,µg/l,2025-10-06T10:12:01.967203Z
Bunthaus,06.10.2025 06:50,Sauerstoffsättigung,88.9,%,2025-10-06T10:12:01.967203Z
Bunthaus,06.10.2025 07:00,Trübung,15.1,FNU,2025-10-06T10:12:01.967203Z
Bunthaus,06.10.2025 07:00,Wassertemperatur,13.2,°C,2025-10-06T10:12:01.967203Z
Bunthaus,06.10.2025 07:00,Sauerstoffkonzentration,9.4,mg/l,2025-10-06T10:12:01.967203Z
Bunthaus,06.10.2025 07:00,pH-Wert,8.4,ohne,2025-10-06T10:12:01.967203Z
Blankenese,06.10.2025 07:00,pH-Wert,7.7,ohne,2025-10-06T10:12:02.033577Z
Blankenese,06.10.2025 07:00,Trübung,70.0,FNU,2025-10-06T10:12:02.033577Z
Blankenese,06.10.2025 07:00,Sauerstoffkonzentration,7.0,mg/l,2025-10-06T10:12:02.033577Z
Blankenese,06.10.2025 07:00,Wassertemperatur,14.6,°C,2025-10-06T10:12:02.033577Z
Blankenese,06.10.2025 07:00,Sauerstoffsättigung,70.0,%,2025-10-06T10:12:02.033577Z
Bunthaus,06.10.2025 11:40,Chlorophyll Kieselalgen,38.8,µg/l,2025-10-06T10:29:02.007818Z
Bunthaus,06.10.2025 11:40,Chlorophyll Grünalgen,31.8,µg/l,2025-10-06T10:29:02.007818Z
Bunthaus,06.10.2025 11:40,Chlorophyll (gesamt),76.0,µg/l,2025-10-06T10:29:02.007818Z
Bunthaus,06.10.2025 11:50,Trübung,15.2,FNU,2025-10-06T10:29:02.007818Z
Bunthaus,06.10.2025 11:50,Sauerstoffsättigung,98.9,%,2025-10-06T10:29:02.007818Z
Bunthaus,06.10.2025 12:00,Wassertemperatur,12.6,°C,2025-10-06T10:29:02.007818Z
Bunthaus,06.10.2025 12:00,pH-Wert,8.4,ohne,2025-10-06T10:29:02.007818Z
Bunthaus,06.10.2025 12:00,Sauerstoffkonzentration,10.5,mg/l,2025-10-06T10:29:02.007818Z
Blankenese,06.10.2025 12:00,pH-Wert,7.8,ohne,2025-10-06T10:29:02.085764Z
Blankenese,06.10.2025 12:00,Wassertemperatur,14.4,°C,2025-10-06T10:29:02.085764Z
Blankenese,06.10.2025 12:00,Sauerstoffkonzentration,6.8,mg/l,2025-10-06T10:29:02.085764Z
Blankenese,06.10.2025 12:00,Sauerstoffsättigung,67.0,%,2025-10-06T10:29:02.085764Z
Blankenese,06.10.2025 12:00,Trübung,33.1,FNU,2025-10-06T10:29:02.085764Z
Bunthaus,06.10.2025 11:40,Chlorophyll Kieselalgen,38.8,µg/l,2025-10-06T10:38:24.188597Z
Bunthaus,06.10.2025 11:40,Chlorophyll Grünalgen,31.8,µg/l,2025-10-06T10:38:24.188597Z
Bunthaus,06.10.2025 11:40,Chlorophyll (gesamt),76.0,µg/l,2025-10-06T10:38:24.188597Z
Bunthaus,06.10.2025 11:50,Trübung,15.2,FNU,2025-10-06T10:38:24.188597Z
Bunthaus,06.10.2025 11:50,Sauerstoffsättigung,98.9,%,2025-10-06T10:38:24.188597Z
Bunthaus,06.10.2025 12:00,Wassertemperatur,12.6,°C,2025-10-06T10:38:24.188597Z
Bunthaus,06.10.2025 12:00,pH-Wert,8.4,ohne,2025-10-06T10:38:24.188597Z
Bunthaus,06.10.2025 12:00,Sauerstoffkonzentration,10.5,mg/l,2025-10-06T10:38:24.188597Z
Blankenese,06.10.2025 12:00,pH-Wert,7.8,ohne,2025-10-06T10:38:24.245252Z
Blankenese,06.10.2025 12:00,Wassertemperatur,14.4,°C,2025-10-06T10:38:24.245252Z
Blankenese,06.10.2025 12:00,Sauerstoffkonzentration,6.8,mg/l,2025-10-06T10:38:24.245252Z
Blankenese,06.10.2025 12:00,Sauerstoffsättigung,67.0,%,2025-10-06T10:38:24.245252Z
Blankenese,06.10.2025 12:00,Trübung,33.1,FNU,2025-10-06T10:38:24.245252Z
Bunthaus,06.10.2025 11:40,Chlorophyll Kieselalgen,38.8,µg/l,2025-10-06T10:39:01.719427Z
Bunthaus,06.10.2025 11:40,Chlorophyll Grünalgen,31.8,µg/l,2025-10-06T10:39:01.719427Z
Bunthaus,06.10.2025 11:40,Chlorophyll (gesamt),76.0,µg/l,2025-10-06T10:39:01.719427Z
Bunthaus,06.10.2025 11:50,Trübung,15.2,FNU,2025-10-06T10:39:01.719427Z
Bunthaus,06.10.2025 11:50,Sauerstoffsättigung,98.9,%,2025-10-06T10:39:01.719427Z
Bunthaus,06.10.2025 12:00,Wassertemperatur,12.6,°C,2025-10-06T10:39:01.719427Z
Bunthaus,06.10.2025 12:00,pH-Wert,8.4,ohne,2025-10-06T10:39:01.719427Z
Bunthaus,06.10.2025 12:00,Sauerstoffkonzentration,10.5,mg/l,2025-10-06T10:39:01.719427Z
Blankenese,06.10.2025 12:00,pH-Wert,7.8,ohne,2025-10-06T10:39:01.797641Z
Blankenese,06.10.2025 12:00,Wassertemperatur,14.4,°C,2025-10-06T10:39:01.797641Z
Blankenese,06.10.2025 12:00,Sauerstoffkonzentration,6.8,mg/l,2025-10-06T10:39:01.797641Z
Blankenese,06.10.2025 12:00,Sauerstoffsättigung,67.0,%,2025-10-06T10:39:01.797641Z
Blankenese,06.10.2025 12:00,Trübung,33.1,FNU,2025-10-06T10:39:01.797641Z
Bunthaus,06.10.2025 11:40,Chlorophyll Kieselalgen,38.8,µg/l,2025-10-06T10:40:02.319923Z
Bunthaus,06.10.2025 11:40,Chlorophyll Grünalgen,31.8,µg/l,2025-10-06T10:40:02.319923Z
Bunthaus,06.10.2025 11:40,Chlorophyll (gesamt),76.0,µg/l,2025-10-06T10:40:02.319923Z
Bunthaus,06.10.2025 11:50,Trübung,15.2,FNU,2025-10-06T10:40:02.319923Z
Bunthaus,06.10.2025 11:50,Sauerstoffsättigung,98.9,%,2025-10-06T10:40:02.319923Z
Bunthaus,06.10.2025 12:00,Wassertemperatur,12.6,°C,2025-10-06T10:40:02.319923Z
Bunthaus,06.10.2025 12:00,pH-Wert,8.4,ohne,2025-10-06T10:40:02.319923Z
Bunthaus,06.10.2025 12:00,Sauerstoffkonzentration,10.5,mg/l,2025-10-06T10:40:02.319923Z
Blankenese,06.10.2025 12:00,pH-Wert,7.8,ohne,2025-10-06T10:40:02.402320Z
Blankenese,06.10.2025 12:00,Wassertemperatur,14.4,°C,2025-10-06T10:40:02.402320Z
Blankenese,06.10.2025 12:00,Sauerstoffkonzentration,6.8,mg/l,2025-10-06T10:40:02.402320Z
Blankenese,06.10.2025 12:00,Sauerstoffsättigung,67.0,%,2025-10-06T10:40:02.402320Z
Blankenese,06.10.2025 12:00,Trübung,33.1,FNU,2025-10-06T10:40:02.402320Z
Bunthaus,06.10.2025 11:40,Chlorophyll Kieselalgen,38.8,µg/l,2025-10-06T10:41:01.756191Z
Bunthaus,06.10.2025 11:40,Chlorophyll Grünalgen,31.8,µg/l,2025-10-06T10:41:01.756191Z
Bunthaus,06.10.2025 11:40,Chlorophyll (gesamt),76.0,µg/l,2025-10-06T10:41:01.756191Z
Bunthaus,06.10.2025 11:50,Trübung,15.2,FNU,2025-10-06T10:41:01.756191Z
Bunthaus,06.10.2025 11:50,Sauerstoffsättigung,98.9,%,2025-10-06T10:41:01.756191Z
Bunthaus,06.10.2025 12:00,Wassertemperatur,12.6,°C,2025-10-06T10:41:01.756191Z
Bunthaus,06.10.2025 12:00,pH-Wert,8.4,ohne,2025-10-06T10:41:01.756191Z
Bunthaus,06.10.2025 12:00,Sauerstoffkonzentration,10.5,mg/l,2025-10-06T10:41:01.756191Z
Blankenese,06.10.2025 12:00,pH-Wert,7.8,ohne,2025-10-06T10:41:01.818476Z
Blankenese,06.10.2025 12:00,Wassertemperatur,14.4,°C,2025-10-06T10:41:01.818476Z
Blankenese,06.10.2025 12:00,Sauerstoffkonzentration,6.8,mg/l,2025-10-06T10:41:01.818476Z
Blankenese,06.10.2025 12:00,Sauerstoffsättigung,67.0,%,2025-10-06T10:41:01.818476Z
Blankenese,06.10.2025 12:00,Trübung,33.1,FNU,2025-10-06T10:41:01.818476Z
Bunthaus,06.10.2025 11:40,Chlorophyll Kieselalgen,38.8,µg/l,2025-10-06T10:42:01.199480Z
Bunthaus,06.10.2025 11:40,Chlorophyll Grünalgen,31.8,µg/l,2025-10-06T10:42:01.199480Z
Bunthaus,06.10.2025 11:40,Chlorophyll (gesamt),76.0,µg/l,2025-10-06T10:42:01.199480Z
Bunthaus,06.10.2025 11:50,Trübung,15.2,FNU,2025-10-06T10:42:01.199480Z
Bunthaus,06.10.2025 11:50,Sauerstoffsättigung,98.9,%,2025-10-06T10:42:01.199480Z
Bunthaus,06.10.2025 12:00,Wassertemperatur,12.6,°C,2025-10-06T10:42:01.199480Z
Bunthaus,06.10.2025 12:00,pH-Wert,8.4,ohne,2025-10-06T10:42:01.199480Z
Bunthaus,06.10.2025 12:00,Sauerstoffkonzentration,10.5,mg/l,2025-10-06T10:42:01.199480Z
Blankenese,06.10.2025 12:00,pH-Wert,7.8,ohne,2025-10-06T10:42:01.261941Z
Blankenese,06.10.2025 12:00,Wassertemperatur,14.4,°C,2025-10-06T10:42:01.261941Z
Blankenese,06.10.2025 12:00,Sauerstoffkonzentration,6.8,mg/l,2025-10-06T10:42:01.261941Z
Blankenese,06.10.2025 12:00,Sauerstoffsättigung,67.0,%,2025-10-06T10:42:01.261941Z
Blankenese,06.10.2025 12:00,Trübung,33.1,FNU,2025-10-06T10:42:01.261941Z
Bunthaus,06.10.2025 11:40,Chlorophyll Kieselalgen,38.8,µg/l,2025-10-06T10:43:01.717756Z
Bunthaus,06.10.2025 11:40,Chlorophyll Grünalgen,31.8,µg/l,2025-10-06T10:43:01.717756Z
Bunthaus,06.10.2025 11:40,Chlorophyll (gesamt),76.0,µg/l,2025-10-06T10:43:01.717756Z
Bunthaus,06.10.2025 11:50,Trübung,15.2,FNU,2025-10-06T10:43:01.717756Z
Bunthaus,06.10.2025 11:50,Sauerstoffsättigung,98.9,%,2025-10-06T10:43:01.717756Z
Bunthaus,06.10.2025 12:00,Wassertemperatur,12.6,°C,2025-10-06T10:43:01.717756Z
Bunthaus,06.10.2025 12:00,pH-Wert,8.4,ohne,2025-10-06T10:43:01.717756Z
Bunthaus,06.10.2025 12:00,Sauerstoffkonzentration,10.5,mg/l,2025-10-06T10:43:01.717756Z
Blankenese,06.10.2025 12:00,pH-Wert,7.8,ohne,2025-10-06T10:43:01.801674Z
Blankenese,06.10.2025 12:00,Wassertemperatur,14.4,°C,2025-10-06T10:43:01.801674Z
Blankenese,06.10.2025 12:00,Sauerstoffkonzentration,6.8,mg/l,2025-10-06T10:43:01.801674Z
Blankenese,06.10.2025 12:00,Sauerstoffsättigung,67.0,%,2025-10-06T10:43:01.801674Z
Blankenese,06.10.2025 12:00,Trübung,33.1,FNU,2025-10-06T10:43:01.801674Z
Bunthaus,06.10.2025 11:40,Chlorophyll Kieselalgen,38.8,µg/l,2025-10-06T10:44:02.350582Z
Bunthaus,06.10.2025 11:40,Chlorophyll Grünalgen,31.8,µg/l,2025-10-06T10:44:02.350582Z
Bunthaus,06.10.2025 11:40,Chlorophyll (gesamt),76.0,µg/l,2025-10-06T10:44:02.350582Z
Bunthaus,06.10.2025 11:50,Trübung,15.2,FNU,2025-10-06T10:44:02.350582Z
Bunthaus,06.10.2025 11:50,Sauerstoffsättigung,98.9,%,2025-10-06T10:44:02.350582Z
Bunthaus,06.10.2025 12:00,Wassertemperatur,12.6,°C,2025-10-06T10:44:02.350582Z
Bunthaus,06.10.2025 12:00,pH-Wert,8.4,ohne,2025-10-06T10:44:02.350582Z
Bunthaus,06.10.2025 12:00,Sauerstoffkonzentration,10.5,mg/l,2025-10-06T10:44:02.350582Z
Blankenese,06.10.2025 12:00,pH-Wert,7.8,ohne,2025-10-06T10:44:02.416497Z
Blankenese,06.10.2025 12:00,Wassertemperatur,14.4,°C,2025-10-06T10:44:02.416497Z
Blankenese,06.10.2025 12:00,Sauerstoffkonzentration,6.8,mg/l,2025-10-06T10:44:02.416497Z
Blankenese,06.10.2025 12:00,Sauerstoffsättigung,67.0,%,2025-10-06T10:44:02.416497Z
Blankenese,06.10.2025 12:00,Trübung,33.1,FNU,2025-10-06T10:44:02.416497Z
Bunthaus,06.10.2025 11:40,Chlorophyll Kieselalgen,38.8,µg/l,2025-10-06T10:45:02.003403Z
Bunthaus,06.10.2025 11:40,Chlorophyll Grünalgen,31.8,µg/l,2025-10-06T10:45:02.003403Z
Bunthaus,06.10.2025 11:40,Chlorophyll (gesamt),76.0,µg/l,2025-10-06T10:45:02.003403Z
Bunthaus,06.10.2025 11:50,Trübung,15.2,FNU,2025-10-06T10:45:02.003403Z
Bunthaus,06.10.2025 11:50,Sauerstoffsättigung,98.9,%,2025-10-06T10:45:02.003403Z
Bunthaus,06.10.2025 12:00,Wassertemperatur,12.6,°C,2025-10-06T10:45:02.003403Z
Bunthaus,06.10.2025 12:00,pH-Wert,8.4,ohne,2025-10-06T10:45:02.003403Z
Bunthaus,06.10.2025 12:00,Sauerstoffkonzentration,10.5,mg/l,2025-10-06T10:45:02.003403Z
Blankenese,06.10.2025 12:00,pH-Wert,7.8,ohne,2025-10-06T10:45:02.089895Z
Blankenese,06.10.2025 12:00,Wassertemperatur,14.4,°C,2025-10-06T10:45:02.089895Z
Blankenese,06.10.2025 12:00,Sauerstoffkonzentration,6.8,mg/l,2025-10-06T10:45:02.089895Z
Blankenese,06.10.2025 12:00,Sauerstoffsättigung,67.0,%,2025-10-06T10:45:02.089895Z
Blankenese,06.10.2025 12:00,Trübung,33.1,FNU,2025-10-06T10:45:02.089895Z
Bunthaus,06.10.2025 11:40,Chlorophyll Kieselalgen,38.8,µg/l,2025-10-06T10:46:01.510115Z
Bunthaus,06.10.2025 11:40,Chlorophyll Grünalgen,31.8,µg/l,2025-10-06T10:46:01.510115Z
Bunthaus,06.10.2025 11:40,Chlorophyll (gesamt),76.0,µg/l,2025-10-06T10:46:01.510115Z
Bunthaus,06.10.2025 11:50,Trübung,15.2,FNU,2025-10-06T10:46:01.510115Z
Bunthaus,06.10.2025 11:50,Sauerstoffsättigung,98.9,%,2025-10-06T10:46:01.510115Z
Bunthaus,06.10.2025 12:00,Wassertemperatur,12.6,°C,2025-10-06T10:46:01.510115Z
Bunthaus,06.10.2025 12:00,pH-Wert,8.4,ohne,2025-10-06T10:46:01.510115Z
Bunthaus,06.10.2025 12:00,Sauerstoffkonzentration,10.5,mg/l,2025-10-06T10:46:01.510115Z
Blankenese,06.10.2025 12:00,pH-Wert,7.8,ohne,2025-10-06T10:46:01.587853Z
Blankenese,06.10.2025 12:00,Wassertemperatur,14.4,°C,2025-10-06T10:46:01.587853Z
Blankenese,06.10.2025 12:00,Sauerstoffkonzentration,6.8,mg/l,2025-10-06T10:46:01.587853Z
Blankenese,06.10.2025 12:00,Sauerstoffsättigung,67.0,%,2025-10-06T10:46:01.587853Z
Blankenese,06.10.2025 12:00,Trübung,33.1,FNU,2025-10-06T10:46:01.587853Z
Bunthaus,06.10.2025 11:40,Chlorophyll Kieselalgen,38.8,µg/l,2025-10-06T10:47:02.083864Z
Bunthaus,06.10.2025 11:40,Chlorophyll Grünalgen,31.8,µg/l,2025-10-06T10:47:02.083864Z
Bunthaus,06.10.2025 11:40,Chlorophyll (gesamt),76.0,µg/l,2025-10-06T10:47:02.083864Z
Bunthaus,06.10.2025 11:50,Trübung,15.2,FNU,2025-10-06T10:47:02.083864Z
Bunthaus,06.10.2025 11:50,Sauerstoffsättigung,98.9,%,2025-10-06T10:47:02.083864Z
Bunthaus,06.10.2025 12:00,Wassertemperatur,12.6,°C,2025-10-06T10:47:02.083864Z
Bunthaus,06.10.2025 12:00,pH-Wert,8.4,ohne,2025-10-06T10:47:02.083864Z
Bunthaus,06.10.2025 12:00,Sauerstoffkonzentration,10.5,mg/l,2025-10-06T10:47:02.083864Z
Blankenese,06.10.2025 12:00,pH-Wert,7.8,ohne,2025-10-06T10:47:02.162975Z
Blankenese,06.10.2025 12:00,Wassertemperatur,14.4,°C,2025-10-06T10:47:02.162975Z
Blankenese,06.10.2025 12:00,Sauerstoffkonzentration,6.8,mg/l,2025-10-06T10:47:02.162975Z
Blankenese,06.10.2025 12:00,Sauerstoffsättigung,67.0,%,2025-10-06T10:47:02.162975Z
Blankenese,06.10.2025 12:00,Trübung,33.1,FNU,2025-10-06T10:47:02.162975Z
Bunthaus,06.10.2025 11:40,Chlorophyll Kieselalgen,38.8,µg/l,2025-10-06T10:48:01.641113Z
Bunthaus,06.10.2025 11:40,Chlorophyll Grünalgen,31.8,µg/l,2025-10-06T10:48:01.641113Z
Bunthaus,06.10.2025 11:40,Chlorophyll (gesamt),76.0,µg/l,2025-10-06T10:48:01.641113Z
Bunthaus,06.10.2025 11:50,Trübung,15.2,FNU,2025-10-06T10:48:01.641113Z
Bunthaus,06.10.2025 11:50,Sauerstoffsättigung,98.9,%,2025-10-06T10:48:01.641113Z
Bunthaus,06.10.2025 12:00,Wassertemperatur,12.6,°C,2025-10-06T10:48:01.641113Z
Bunthaus,06.10.2025 12:00,pH-Wert,8.4,ohne,2025-10-06T10:48:01.641113Z
Bunthaus,06.10.2025 12:00,Sauerstoffkonzentration,10.5,mg/l,2025-10-06T10:48:01.641113Z
Blankenese,06.10.2025 12:00,pH-Wert,7.8,ohne,2025-10-06T10:48:01.702572Z
Blankenese,06.10.2025 12:00,Wassertemperatur,14.4,°C,2025-10-06T10:48:01.702572Z
Blankenese,06.10.2025 12:00,Sauerstoffkonzentration,6.8,mg/l,2025-10-06T10:48:01.702572Z
Blankenese,06.10.2025 12:00,Sauerstoffsättigung,67.0,%,2025-10-06T10:48:01.702572Z
Blankenese,06.10.2025 12:00,Trübung,33.1,FNU,2025-10-06T10:48:01.702572Z
Bunthaus,06.10.2025 11:40,Chlorophyll Kieselalgen,38.8,µg/l,2025-10-06T10:49:02.076509Z
Bunthaus,06.10.2025 11:40,Chlorophyll Grünalgen,31.8,µg/l,2025-10-06T10:49:02.076509Z
Bunthaus,06.10.2025 11:40,Chlorophyll (gesamt),76.0,µg/l,2025-10-06T10:49:02.076509Z
Bunthaus,06.10.2025 11:50,Trübung,15.2,FNU,2025-10-06T10:49:02.076509Z
Bunthaus,06.10.2025 11:50,Sauerstoffsättigung,98.9,%,2025-10-06T10:49:02.076509Z
Bunthaus,06.10.2025 12:00,Wassertemperatur,12.6,°C,2025-10-06T10:49:02.076509Z
Bunthaus,06.10.2025 12:00,pH-Wert,8.4,ohne,2025-10-06T10:49:02.076509Z
Bunthaus,06.10.2025 12:00,Sauerstoffkonzentration,10.5,mg/l,2025-10-06T10:49:02.076509Z
Blankenese,06.10.2025 12:00,pH-Wert,7.8,ohne,2025-10-06T10:49:02.152462Z
Blankenese,06.10.2025 12:00,Wassertemperatur,14.4,°C,2025-10-06T10:49:02.152462Z
Blankenese,06.10.2025 12:00,Sauerstoffkonzentration,6.8,mg/l,2025-10-06T10:49:02.152462Z
Blankenese,06.10.2025 12:00,Sauerstoffsättigung,67.0,%,2025-10-06T10:49:02.152462Z
Blankenese,06.10.2025 12:00,Trübung,33.1,FNU,2025-10-06T10:49:02.152462Z
Bunthaus,06.10.2025 11:40,Chlorophyll Kieselalgen,38.8,µg/l,2025-10-06T13:03:11.283277Z
Bunthaus,06.10.2025 11:40,Chlorophyll Grünalgen,31.8,µg/l,2025-10-06T13:03:11.283277Z
Bunthaus,06.10.2025 11:40,Chlorophyll (gesamt),76.0,µg/l,2025-10-06T13:03:11.283277Z
Bunthaus,06.10.2025 11:50,Trübung,15.2,FNU,2025-10-06T13:03:11.283277Z
Bunthaus,06.10.2025 11:50,Sauerstoffsättigung,98.9,%,2025-10-06T13:03:11.283277Z
Bunthaus,06.10.2025 12:00,Wassertemperatur,12.6,°C,2025-10-06T13:03:11.283277Z
Bunthaus,06.10.2025 12:00,pH-Wert,8.4,ohne,2025-10-06T13:03:11.283277Z
Bunthaus,06.10.2025 12:00,Sauerstoffkonzentration,10.5,mg/l,2025-10-06T13:03:11.283277Z
Blankenese,06.10.2025 12:00,pH-Wert,7.8,ohne,2025-10-06T13:03:11.353750Z
Blankenese,06.10.2025 12:00,Wassertemperatur,14.4,°C,2025-10-06T13:03:11.353750Z
Blankenese,06.10.2025 12:00,Sauerstoffkonzentration,6.8,mg/l,2025-10-06T13:03:11.353750Z
Blankenese,06.10.2025 12:00,Sauerstoffsättigung,67.0,%,2025-10-06T13:03:11.353750Z
Blankenese,06.10.2025 12:00,Trübung,33.1,FNU,2025-10-06T13:03:11.353750Z
Bunthaus,06.10.2025 12:00,pH-Wert,8.4,ohne,2025-10-06T16:00:02.234382Z
Bunthaus,06.10.2025 15:00,Chlorophyll Grünalgen,32.2,µg/l,2025-10-06T16:00:02.234382Z
Bunthaus,06.10.2025 15:00,Chlorophyll Kieselalgen,38.2,µg/l,2025-10-06T16:00:02.234382Z
Bunthaus,06.10.2025 15:00,Chlorophyll (gesamt),75.9,µg/l,2025-10-06T16:00:02.234382Z
Bunthaus,06.10.2025 15:50,Sauerstoffsättigung,101.0,%,2025-10-06T16:00:02.234382Z
Bunthaus,06.10.2025 15:50,Wassertemperatur,13.1,°C,2025-10-06T16:00:02.234382Z
Bunthaus,06.10.2025 15:50,Sauerstoffkonzentration,10.6,mg/l,2025-10-06T16:00:02.234382Z
Bunthaus,06.10.2025 15:50,Trübung,16.1,FNU,2025-10-06T16:00:02.234382Z
Blankenese,06.10.2025 16:00,Trübung,36.9,FNU,2025-10-06T16:00:02.315801Z
Blankenese,06.10.2025 16:00,Wassertemperatur,14.6,°C,2025-10-06T16:00:02.315801Z
Blankenese,06.10.2025 16:00,Sauerstoffkonzentration,6.9,mg/l,2025-10-06T16:00:02.315801Z
Blankenese,06.10.2025 16:00,Sauerstoffsättigung,68.9,%,2025-10-06T16:00:02.315801Z
Blankenese,06.10.2025 16:00,pH-Wert,7.8,ohne,2025-10-06T16:00:02.315801Z
Bunthaus,06.10.2025 12:00,pH-Wert,8.4,ohne,2025-10-06T19:00:56.120487Z
Bunthaus,06.10.2025 15:00,Chlorophyll Grünalgen,32.2,µg/l,2025-10-06T19:00:56.120487Z
Bunthaus,06.10.2025 15:00,Chlorophyll Kieselalgen,38.2,µg/l,2025-10-06T19:00:56.120487Z
Bunthaus,06.10.2025 15:00,Chlorophyll (gesamt),75.9,µg/l,2025-10-06T19:00:56.120487Z
Bunthaus,06.10.2025 15:50,Sauerstoffsättigung,101.0,%,2025-10-06T19:00:56.120487Z
Bunthaus,06.10.2025 15:50,Wassertemperatur,13.1,°C,2025-10-06T19:00:56.120487Z
Bunthaus,06.10.2025 15:50,Sauerstoffkonzentration,10.6,mg/l,2025-10-06T19:00:56.120487Z
Bunthaus,06.10.2025 15:50,Trübung,16.1,FNU,2025-10-06T19:00:56.120487Z
Blankenese,06.10.2025 16:00,Trübung,36.9,FNU,2025-10-06T19:00:57.092035Z
Blankenese,06.10.2025 16:00,Wassertemperatur,14.6,°C,2025-10-06T19:00:57.092035Z
Blankenese,06.10.2025 16:00,Sauerstoffkonzentration,6.9,mg/l,2025-10-06T19:00:57.092035Z
Blankenese,06.10.2025 16:00,Sauerstoffsättigung,68.9,%,2025-10-06T19:00:57.092035Z
Blankenese,06.10.2025 16:00,pH-Wert,7.8,ohne,2025-10-06T19:00:57.092035Z
Bunthaus,06.10.2025 12:00,pH-Wert,8.4,ohne,2025-10-07T04:01:38.014890Z
Bunthaus,06.10.2025 15:00,Chlorophyll Grünalgen,32.2,µg/l,2025-10-07T04:01:38.014890Z
Bunthaus,06.10.2025 15:00,Chlorophyll Kieselalgen,38.2,µg/l,2025-10-07T04:01:38.014890Z
Bunthaus,06.10.2025 15:00,Chlorophyll (gesamt),75.9,µg/l,2025-10-07T04:01:38.014890Z
Bunthaus,06.10.2025 15:50,Sauerstoffsättigung,101.0,%,2025-10-07T04:01:38.014890Z
Bunthaus,06.10.2025 15:50,Wassertemperatur,13.1,°C,2025-10-07T04:01:38.014890Z
Bunthaus,06.10.2025 15:50,Sauerstoffkonzentration,10.6,mg/l,2025-10-07T04:01:38.014890Z
Bunthaus,06.10.2025 15:50,Trübung,16.1,FNU,2025-10-07T04:01:38.014890Z
Blankenese,06.10.2025 16:00,Trübung,36.9,FNU,2025-10-07T04:01:38.858045Z
Blankenese,06.10.2025 16:00,Wassertemperatur,14.6,°C,2025-10-07T04:01:38.858045Z
Blankenese,06.10.2025 16:00,Sauerstoffkonzentration,6.9,mg/l,2025-10-07T04:01:38.858045Z
Blankenese,06.10.2025 16:00,Sauerstoffsättigung,68.9,%,2025-10-07T04:01:38.858045Z
Blankenese,06.10.2025 16:00,pH-Wert,7.8,ohne,2025-10-07T04:01:38.858045Z
Bunthaus,06.10.2025 12:00,pH-Wert,8.4,ohne,2025-10-07T07:01:10.323903Z
Bunthaus,07.10.2025 06:20,Chlorophyll Grünalgen,24.9,µg/l,2025-10-07T07:01:10.323903Z
Bunthaus,07.10.2025 06:20,Chlorophyll Kieselalgen,21.0,µg/l,2025-10-07T07:01:10.323903Z
Bunthaus,07.10.2025 06:20,Chlorophyll (gesamt),52.1,µg/l,2025-10-07T07:01:10.323903Z
Bunthaus,07.10.2025 07:00,Sauerstoffsättigung,89.8,%,2025-10-07T07:01:10.323903Z
Bunthaus,07.10.2025 07:00,Sauerstoffkonzentration,9.4,mg/l,2025-10-07T07:01:10.323903Z
Bunthaus,07.10.2025 07:00,Wassertemperatur,13.2,°C,2025-10-07T07:01:10.323903Z
Bunthaus,07.10.2025 07:00,Trübung,15.4,FNU,2025-10-07T07:01:10.323903Z
Blankenese,07.10.2025 07:00,Trübung,58.1,FNU,2025-10-07T07:01:10.840708Z
Blankenese,07.10.2025 07:00,Sauerstoffkonzentration,6.8,mg/l,2025-10-07T07:01:10.840708Z
Blankenese,07.10.2025 07:00,pH-Wert,7.7,ohne,2025-10-07T07:01:10.840708Z
Blankenese,07.10.2025 07:00,Wassertemperatur,14.5,°C,2025-10-07T07:01:10.840708Z
Blankenese,07.10.2025 07:00,Sauerstoffsättigung,67.0,%,2025-10-07T07:01:10.840708Z
Bunthaus,06.10.2025 12:00,pH-Wert,8.4,ohne,2025-10-07T10:01:28.182270Z
Bunthaus,07.10.2025 06:20,Chlorophyll Grünalgen,24.9,µg/l,2025-10-07T10:01:28.182270Z
Bunthaus,07.10.2025 06:20,Chlorophyll Kieselalgen,21.0,µg/l,2025-10-07T10:01:28.182270Z
Bunthaus,07.10.2025 06:20,Chlorophyll (gesamt),52.1,µg/l,2025-10-07T10:01:28.182270Z
Bunthaus,07.10.2025 07:00,Sauerstoffsättigung,89.8,%,2025-10-07T10:01:28.182270Z
Bunthaus,07.10.2025 07:00,Sauerstoffkonzentration,9.4,mg/l,2025-10-07T10:01:28.182270Z
Bunthaus,07.10.2025 07:00,Wassertemperatur,13.2,°C,2025-10-07T10:01:28.182270Z
Bunthaus,07.10.2025 07:00,Trübung,15.4,FNU,2025-10-07T10:01:28.182270Z
Blankenese,07.10.2025 07:00,Trübung,58.1,FNU,2025-10-07T10:01:29.444483Z
Blankenese,07.10.2025 07:00,Sauerstoffkonzentration,6.8,mg/l,2025-10-07T10:01:29.444483Z
Blankenese,07.10.2025 07:00,pH-Wert,7.7,ohne,2025-10-07T10:01:29.444483Z
Blankenese,07.10.2025 07:00,Wassertemperatur,14.5,°C,2025-10-07T10:01:29.444483Z
Blankenese,07.10.2025 07:00,Sauerstoffsättigung,67.0,%,2025-10-07T10:01:29.444483Z
Bunthaus,07.10.2025 11:50,Chlorophyll Kieselalgen,32.4,µg/l,2025-10-07T13:01:22.444696Z
Bunthaus,07.10.2025 11:50,Chlorophyll (gesamt),67.9,µg/l,2025-10-07T13:01:22.444696Z
Bunthaus,07.10.2025 11:50,Chlorophyll Grünalgen,28.7,µg/l,2025-10-07T13:01:22.444696Z
Bunthaus,07.10.2025 12:00,pH-Wert,8.1,ohne,2025-10-07T13:01:22.444696Z
Bunthaus,07.10.2025 12:00,Wassertemperatur,12.7,°C,2025-10-07T13:01:22.444696Z
Bunthaus,07.10.2025 12:00,Sauerstoffsättigung,99.1,%,2025-10-07T13:01:22.444696Z
Bunthaus,07.10.2025 12:00,Sauerstoffkonzentration,10.5,mg/l,2025-10-07T13:01:22.444696Z
Bunthaus,07.10.2025 12:00,Trübung,14.6,FNU,2025-10-07T13:01:22.444696Z
Blankenese,07.10.2025 11:40,Wassertemperatur,14.3,°C,2025-10-07T13:01:23.537460Z
Blankenese,07.10.2025 11:40,pH-Wert,7.8,ohne,2025-10-07T13:01:23.537460Z
Blankenese,07.10.2025 11:40,Sauerstoffsättigung,66.2,%,2025-10-07T13:01:23.537460Z
Blankenese,07.10.2025 11:40,Sauerstoffkonzentration,6.7,mg/l,2025-10-07T13:01:23.537460Z
Blankenese,07.10.2025 11:40,Trübung,43.3,FNU,2025-10-07T13:01:23.537460Z
Bunthaus,07.10.2025 15:10,Chlorophyll Kieselalgen,34.6,µg/l,2025-10-07T16:01:10.509769Z
Bunthaus,07.10.2025 15:10,Chlorophyll Grünalgen,30.2,µg/l,2025-10-07T16:01:10.509769Z
Bunthaus,07.10.2025 15:10,Chlorophyll (gesamt),71.4,µg/l,2025-10-07T16:01:10.509769Z
Bunthaus,07.10.2025 16:00,Sauerstoffsättigung,98.1,%,2025-10-07T16:01:10.509769Z
Bunthaus,07.10.2025 16:00,pH-Wert,8.1,ohne,2025-10-07T16:01:10.509769Z
Bunthaus,07.10.2025 16:00,Trübung,16.3,FNU,2025-10-07T16:01:10.509769Z
Bunthaus,07.10.2025 16:00,Wassertemperatur,13.0,°C,2025-10-07T16:01:10.509769Z
Bunthaus,07.10.2025 16:00,Sauerstoffkonzentration,10.3,mg/l,2025-10-07T16:01:10.509769Z
Blankenese,07.10.2025 16:00,Sauerstoffkonzentration,6.6,mg/l,2025-10-07T16:01:11.454489Z
Blankenese,07.10.2025 16:00,pH-Wert,7.7,ohne,2025-10-07T16:01:11.454489Z
Blankenese,07.10.2025 16:00,Trübung,90.6,FNU,2025-10-07T16:01:11.454489Z
Blankenese,07.10.2025 16:00,Wassertemperatur,14.5,°C,2025-10-07T16:01:11.454489Z
Blankenese,07.10.2025 16:00,Sauerstoffsättigung,65.6,%,2025-10-07T16:01:11.454489Z
Bunthaus,07.10.2025 15:10,Chlorophyll Kieselalgen,34.6,µg/l,2025-10-07T19:00:49.242183Z
Bunthaus,07.10.2025 15:10,Chlorophyll Grünalgen,30.2,µg/l,2025-10-07T19:00:49.242183Z
Bunthaus,07.10.2025 15:10,Chlorophyll (gesamt),71.4,µg/l,2025-10-07T19:00:49.242183Z
Bunthaus,07.10.2025 16:00,Sauerstoffsättigung,98.1,%,2025-10-07T19:00:49.242183Z
Bunthaus,07.10.2025 16:00,pH-Wert,8.1,ohne,2025-10-07T19:00:49.242183Z
Bunthaus,07.10.2025 16:00,Trübung,16.3,FNU,2025-10-07T19:00:49.242183Z
Bunthaus,07.10.2025 16:00,Wassertemperatur,13.0,°C,2025-10-07T19:00:49.242183Z
Bunthaus,07.10.2025 16:00,Sauerstoffkonzentration,10.3,mg/l,2025-10-07T19:00:49.242183Z
Blankenese,07.10.2025 16:00,Sauerstoffkonzentration,6.6,mg/l,2025-10-07T19:00:50.167589Z
Blankenese,07.10.2025 16:00,pH-Wert,7.7,ohne,2025-10-07T19:00:50.167589Z
Blankenese,07.10.2025 16:00,Trübung,90.6,FNU,2025-10-07T19:00:50.167589Z
Blankenese,07.10.2025 16:00,Wassertemperatur,14.5,°C,2025-10-07T19:00:50.167589Z
Blankenese,07.10.2025 16:00,Sauerstoffsättigung,65.6,%,2025-10-07T19:00:50.167589Z
Bunthaus,07.10.2025 15:10,Chlorophyll Kieselalgen,34.6,µg/l,2025-10-07T22:01:10.755135Z
Bunthaus,07.10.2025 15:10,Chlorophyll Grünalgen,30.2,µg/l,2025-10-07T22:01:10.755135Z
Bunthaus,07.10.2025 15:10,Chlorophyll (gesamt),71.4,µg/l,2025-10-07T22:01:10.755135Z
Bunthaus,07.10.2025 16:00,Sauerstoffsättigung,98.1,%,2025-10-07T22:01:10.755135Z
Bunthaus,07.10.2025 16:00,pH-Wert,8.1,ohne,2025-10-07T22:01:10.755135Z
Bunthaus,07.10.2025 16:00,Trübung,16.3,FNU,2025-10-07T22:01:10.755135Z
Bunthaus,07.10.2025 16:00,Wassertemperatur,13.0,°C,2025-10-07T22:01:10.755135Z
Bunthaus,07.10.2025 16:00,Sauerstoffkonzentration,10.3,mg/l,2025-10-07T22:01:10.755135Z
Blankenese,07.10.2025 16:00,Sauerstoffkonzentration,6.6,mg/l,2025-10-07T22:01:11.615939Z
Blankenese,07.10.2025 16:00,pH-Wert,7.7,ohne,2025-10-07T22:01:11.615939Z
Blankenese,07.10.2025 16:00,Trübung,90.6,FNU,2025-10-07T22:01:11.615939Z
Blankenese,07.10.2025 16:00,Wassertemperatur,14.5,°C,2025-10-07T22:01:11.615939Z
Blankenese,07.10.2025 16:00,Sauerstoffsättigung,65.6,%,2025-10-07T22:01:11.615939Z
Bunthaus,07.10.2025 15:10,Chlorophyll Kieselalgen,34.6,µg/l,2025-10-08T01:01:02.448883Z
Bunthaus,07.10.2025 15:10,Chlorophyll Grünalgen,30.2,µg/l,2025-10-08T01:01:02.448883Z
Bunthaus,07.10.2025 15:10,Chlorophyll (gesamt),71.4,µg/l,2025-10-08T01:01:02.448883Z
Bunthaus,07.10.2025 16:00,Sauerstoffsättigung,98.1,%,2025-10-08T01:01:02.448883Z
Bunthaus,07.10.2025 16:00,pH-Wert,8.1,ohne,2025-10-08T01:01:02.448883Z
Bunthaus,07.10.2025 16:00,Trübung,16.3,FNU,2025-10-08T01:01:02.448883Z
Bunthaus,07.10.2025 16:00,Wassertemperatur,13.0,°C,2025-10-08T01:01:02.448883Z
Bunthaus,07.10.2025 16:00,Sauerstoffkonzentration,10.3,mg/l,2025-10-08T01:01:02.448883Z
Blankenese,07.10.2025 16:00,Sauerstoffkonzentration,6.6,mg/l,2025-10-08T01:01:03.225583Z
Blankenese,07.10.2025 16:00,pH-Wert,7.7,ohne,2025-10-08T01:01:03.225583Z
Blankenese,07.10.2025 16:00,Trübung,90.6,FNU,2025-10-08T01:01:03.225583Z
Blankenese,07.10.2025 16:00,Wassertemperatur,14.5,°C,2025-10-08T01:01:03.225583Z
Blankenese,07.10.2025 16:00,Sauerstoffsättigung,65.6,%,2025-10-08T01:01:03.225583Z
Bunthaus,07.10.2025 15:10,Chlorophyll Kieselalgen,34.6,µg/l,2025-10-08T04:01:15.346150Z
Bunthaus,07.10.2025 15:10,Chlorophyll Grünalgen,30.2,µg/l,2025-10-08T04:01:15.346150Z
Bunthaus,07.10.2025 15:10,Chlorophyll (gesamt),71.4,µg/l,2025-10-08T04:01:15.346150Z
Bunthaus,07.10.2025 16:00,Sauerstoffsättigung,98.1,%,2025-10-08T04:01:15.346150Z
Bunthaus,07.10.2025 16:00,pH-Wert,8.1,ohne,2025-10-08T04:01:15.346150Z
Bunthaus,07.10.2025 16:00,Trübung,16.3,FNU,2025-10-08T04:01:15.346150Z
Bunthaus,07.10.2025 16:00,Wassertemperatur,13.0,°C,2025-10-08T04:01:15.346150Z
Bunthaus,07.10.2025 16:00,Sauerstoffkonzentration,10.3,mg/l,2025-10-08T04:01:15.346150Z
Blankenese,07.10.2025 16:00,Sauerstoffkonzentration,6.6,mg/l,2025-10-08T04:01:16.326220Z
Blankenese,07.10.2025 16:00,pH-Wert,7.7,ohne,2025-10-08T04:01:16.326220Z
Blankenese,07.10.2025 16:00,Trübung,90.6,FNU,2025-10-08T04:01:16.326220Z
Blankenese,07.10.2025 16:00,Wassertemperatur,14.5,°C,2025-10-08T04:01:16.326220Z
Blankenese,07.10.2025 16:00,Sauerstoffsättigung,65.6,%,2025-10-08T04:01:16.326220Z
Bunthaus,08.10.2025 06:30,Chlorophyll Grünalgen,19.2,µg/l,2025-10-08T07:01:33.796006Z
Bunthaus,08.10.2025 06:30,Chlorophyll (gesamt),38.6,µg/l,2025-10-08T07:01:33.796006Z
Bunthaus,08.10.2025 06:30,Chlorophyll Kieselalgen,13.9,µg/l,2025-10-08T07:01:33.796006Z
Bunthaus,08.10.2025 07:00,Wassertemperatur,13.4,°C,2025-10-08T07:01:33.796006Z
Bunthaus,08.10.2025 07:00,Sauerstoffsättigung,83.2,%,2025-10-08T07:01:33.796006Z
Bunthaus,08.10.2025 07:00,Trübung,15.7,FNU,2025-10-08T07:01:33.796006Z
Bunthaus,08.10.2025 07:00,pH-Wert,7.9,ohne,2025-10-08T07:01:33.796006Z
Bunthaus,08.10.2025 07:00,Sauerstoffkonzentration,8.7,mg/l,2025-10-08T07:01:33.796006Z
Blankenese,08.10.2025 07:00,Sauerstoffkonzentration,6.5,mg/l,2025-10-08T07:01:35.109786Z
Blankenese,08.10.2025 07:00,Wassertemperatur,14.5,°C,2025-10-08T07:01:35.109786Z
Blankenese,08.10.2025 07:00,pH-Wert,7.7,ohne,2025-10-08T07:01:35.109786Z
Blankenese,08.10.2025 07:00,Sauerstoffsättigung,64.9,%,2025-10-08T07:01:35.109786Z
Blankenese,08.10.2025 07:00,Trübung,65.8,FNU,2025-10-08T07:01:35.109786Z
Bunthaus,08.10.2025 06:30,Chlorophyll Grünalgen,19.2,µg/l,2025-10-08T10:00:53.005295Z
Bunthaus,08.10.2025 06:30,Chlorophyll (gesamt),38.6,µg/l,2025-10-08T10:00:53.005295Z
Bunthaus,08.10.2025 06:30,Chlorophyll Kieselalgen,13.9,µg/l,2025-10-08T10:00:53.005295Z
Bunthaus,08.10.2025 07:00,Wassertemperatur,13.4,°C,2025-10-08T10:00:53.005295Z
Bunthaus,08.10.2025 07:00,Sauerstoffsättigung,83.2,%,2025-10-08T10:00:53.005295Z
Bunthaus,08.10.2025 07:00,Trübung,15.7,FNU,2025-10-08T10:00:53.005295Z
Bunthaus,08.10.2025 07:00,pH-Wert,7.9,ohne,2025-10-08T10:00:53.005295Z
Bunthaus,08.10.2025 07:00,Sauerstoffkonzentration,8.7,mg/l,2025-10-08T10:00:53.005295Z
Blankenese,08.10.2025 07:00,Sauerstoffkonzentration,6.5,mg/l,2025-10-08T10:00:53.962911Z
Blankenese,08.10.2025 07:00,Wassertemperatur,14.5,°C,2025-10-08T10:00:53.962911Z
Blankenese,08.10.2025 07:00,pH-Wert,7.7,ohne,2025-10-08T10:00:53.962911Z
Blankenese,08.10.2025 07:00,Sauerstoffsättigung,64.9,%,2025-10-08T10:00:53.962911Z
Blankenese,08.10.2025 07:00,Trübung,65.8,FNU,2025-10-08T10:00:53.962911Z
Bunthaus,08.10.2025 12:00,Chlorophyll Kieselalgen,28.8,µg/l,2025-10-08T13:01:11.579490Z
Bunthaus,08.10.2025 12:00,Sauerstoffsättigung,98.9,%,2025-10-08T13:01:11.579490Z
Bunthaus,08.10.2025 12:00,Wassertemperatur,12.9,°C,2025-10-08T13:01:11.579490Z
Bunthaus,08.10.2025 12:00,Chlorophyll Grünalgen,27.4,µg/l,2025-10-08T13:01:11.579490Z
Bunthaus,08.10.2025 12:00,Trübung,11.1,FNU,2025-10-08T13:01:11.579490Z
Bunthaus,08.10.2025 12:00,Sauerstoffkonzentration,10.4,mg/l,2025-10-08T13:01:11.579490Z
Bunthaus,08.10.2025 12:00,Chlorophyll (gesamt),61.3,µg/l,2025-10-08T13:01:11.579490Z
Bunthaus,08.10.2025 12:00,pH-Wert,8.1,ohne,2025-10-08T13:01:11.579490Z
Blankenese,08.10.2025 12:00,pH-Wert,7.8,ohne,2025-10-08T13:01:12.369100Z
Blankenese,08.10.2025 12:00,Trübung,40.8,FNU,2025-10-08T13:01:12.369100Z
Blankenese,08.10.2025 12:00,Sauerstoffsättigung,64.7,%,2025-10-08T13:01:12.369100Z
Blankenese,08.10.2025 12:00,Sauerstoffkonzentration,6.5,mg/l,2025-10-08T13:01:12.369100Z
Blankenese,08.10.2025 12:00,Wassertemperatur,14.3,°C,2025-10-08T13:01:12.369100Z
Bunthaus,08.10.2025 15:20,Chlorophyll Grünalgen,29.9,µg/l,2025-10-08T16:01:20.555074Z
Bunthaus,08.10.2025 15:20,Chlorophyll (gesamt),65.3,µg/l,2025-10-08T16:01:20.555074Z
Bunthaus,08.10.2025 15:20,Chlorophyll Kieselalgen,29.8,µg/l,2025-10-08T16:01:20.555074Z
Bunthaus,08.10.2025 16:00,Sauerstoffkonzentration,10.5,mg/l,2025-10-08T16:01:20.555074Z
Bunthaus,08.10.2025 16:00,Trübung,14.8,FNU,2025-10-08T16:01:20.555074Z
Bunthaus,08.10.2025 16:00,Sauerstoffsättigung,100.5,%,2025-10-08T16:01:20.555074Z
Bunthaus,08.10.2025 16:00,pH-Wert,8.1,ohne,2025-10-08T16:01:20.555074Z
Bunthaus,08.10.2025 16:00,Wassertemperatur,13.1,°C,2025-10-08T16:01:20.555074Z
Blankenese,08.10.2025 16:00,Sauerstoffsättigung,63.6,%,2025-10-08T16:01:21.644147Z
Blankenese,08.10.2025 16:00,pH-Wert,7.7,ohne,2025-10-08T16:01:21.644147Z
Blankenese,08.10.2025 16:00,Wassertemperatur,14.5,°C,2025-10-08T16:01:21.644147Z
Blankenese,08.10.2025 16:00,Sauerstoffkonzentration,6.4,mg/l,2025-10-08T16:01:21.644147Z
Blankenese,08.10.2025 16:00,Trübung,161.9,FNU,2025-10-08T16:01:21.644147Z
Bunthaus,08.10.2025 15:20,Chlorophyll Grünalgen,29.9,µg/l,2025-10-08T19:00:56.850877Z
Bunthaus,08.10.2025 15:20,Chlorophyll (gesamt),65.3,µg/l,2025-10-08T19:00:56.850877Z
Bunthaus,08.10.2025 15:20,Chlorophyll Kieselalgen,29.8,µg/l,2025-10-08T19:00:56.850877Z
Bunthaus,08.10.2025 16:00,Sauerstoffkonzentration,10.5,mg/l,2025-10-08T19:00:56.850877Z
Bunthaus,08.10.2025 16:00,Trübung,14.8,FNU,2025-10-08T19:00:56.850877Z
Bunthaus,08.10.2025 16:00,Sauerstoffsättigung,100.5,%,2025-10-08T19:00:56.850877Z
Bunthaus,08.10.2025 16:00,pH-Wert,8.1,ohne,2025-10-08T19:00:56.850877Z
Bunthaus,08.10.2025 16:00,Wassertemperatur,13.1,°C,2025-10-08T19:00:56.850877Z
Blankenese,08.10.2025 16:00,Sauerstoffsättigung,63.6,%,2025-10-08T19:00:57.770646Z
Blankenese,08.10.2025 16:00,pH-Wert,7.7,ohne,2025-10-08T19:00:57.770646Z
Blankenese,08.10.2025 16:00,Wassertemperatur,14.5,°C,2025-10-08T19:00:57.770646Z
Blankenese,08.10.2025 16:00,Sauerstoffkonzentration,6.4,mg/l,2025-10-08T19:00:57.770646Z
Blankenese,08.10.2025 16:00,Trübung,161.9,FNU,2025-10-08T19:00:57.770646Z
Bunthaus,08.10.2025 15:20,Chlorophyll Grünalgen,29.9,µg/l,2025-10-08T22:00:50.836470Z
Bunthaus,08.10.2025 15:20,Chlorophyll (gesamt),65.3,µg/l,2025-10-08T22:00:50.836470Z
Bunthaus,08.10.2025 15:20,Chlorophyll Kieselalgen,29.8,µg/l,2025-10-08T22:00:50.836470Z
Bunthaus,08.10.2025 16:00,Sauerstoffkonzentration,10.5,mg/l,2025-10-08T22:00:50.836470Z
Bunthaus,08.10.2025 16:00,Trübung,14.8,FNU,2025-10-08T22:00:50.836470Z
Bunthaus,08.10.2025 16:00,Sauerstoffsättigung,100.5,%,2025-10-08T22:00:50.836470Z
Bunthaus,08.10.2025 16:00,pH-Wert,8.1,ohne,2025-10-08T22:00:50.836470Z
Bunthaus,08.10.2025 16:00,Wassertemperatur,13.1,°C,2025-10-08T22:00:50.836470Z
Blankenese,08.10.2025 16:00,Sauerstoffsättigung,63.6,%,2025-10-08T22:00:51.754116Z
Blankenese,08.10.2025 16:00,pH-Wert,7.7,ohne,2025-10-08T22:00:51.754116Z
Blankenese,08.10.2025 16:00,Wassertemperatur,14.5,°C,2025-10-08T22:00:51.754116Z
Blankenese,08.10.2025 16:00,Sauerstoffkonzentration,6.4,mg/l,2025-10-08T22:00:51.754116Z
Blankenese,08.10.2025 16:00,Trübung,161.9,FNU,2025-10-08T22:00:51.754116Z
Bunthaus,08.10.2025 15:20,Chlorophyll Grünalgen,29.9,µg/l,2025-10-09T01:00:56.962842Z
Bunthaus,08.10.2025 15:20,Chlorophyll (gesamt),65.3,µg/l,2025-10-09T01:00:56.962842Z
Bunthaus,08.10.2025 15:20,Chlorophyll Kieselalgen,29.8,µg/l,2025-10-09T01:00:56.962842Z
Bunthaus,08.10.2025 16:00,Sauerstoffkonzentration,10.5,mg/l,2025-10-09T01:00:56.962842Z
Bunthaus,08.10.2025 16:00,Trübung,14.8,FNU,2025-10-09T01:00:56.962842Z
Bunthaus,08.10.2025 16:00,Sauerstoffsättigung,100.5,%,2025-10-09T01:00:56.962842Z
Bunthaus,08.10.2025 16:00,pH-Wert,8.1,ohne,2025-10-09T01:00:56.962842Z
Bunthaus,08.10.2025 16:00,Wassertemperatur,13.1,°C,2025-10-09T01:00:56.962842Z
Blankenese,08.10.2025 16:00,Sauerstoffsättigung,63.6,%,2025-10-09T01:00:57.878952Z
Blankenese,08.10.2025 16:00,pH-Wert,7.7,ohne,2025-10-09T01:00:57.878952Z
Blankenese,08.10.2025 16:00,Wassertemperatur,14.5,°C,2025-10-09T01:00:57.878952Z
Blankenese,08.10.2025 16:00,Sauerstoffkonzentration,6.4,mg/l,2025-10-09T01:00:57.878952Z
Blankenese,08.10.2025 16:00,Trübung,161.9,FNU,2025-10-09T01:00:57.878952Z
Bunthaus,08.10.2025 15:20,Chlorophyll Grünalgen,29.9,µg/l,2025-10-09T04:01:21.925717Z
Bunthaus,08.10.2025 15:20,Chlorophyll (gesamt),65.3,µg/l,2025-10-09T04:01:21.925717Z
Bunthaus,08.10.2025 15:20,Chlorophyll Kieselalgen,29.8,µg/l,2025-10-09T04:01:21.925717Z
Bunthaus,08.10.2025 16:00,Sauerstoffkonzentration,10.5,mg/l,2025-10-09T04:01:21.925717Z
Bunthaus,08.10.2025 16:00,Trübung,14.8,FNU,2025-10-09T04:01:21.925717Z
Bunthaus,08.10.2025 16:00,Sauerstoffsättigung,100.5,%,2025-10-09T04:01:21.925717Z
Bunthaus,08.10.2025 16:00,pH-Wert,8.1,ohne,2025-10-09T04:01:21.925717Z
Bunthaus,08.10.2025 16:00,Wassertemperatur,13.1,°C,2025-10-09T04:01:21.925717Z
Blankenese,08.10.2025 16:00,Sauerstoffsättigung,63.6,%,2025-10-09T04:01:23.109664Z
Blankenese,08.10.2025 16:00,pH-Wert,7.7,ohne,2025-10-09T04:01:23.109664Z
Blankenese,08.10.2025 16:00,Wassertemperatur,14.5,°C,2025-10-09T04:01:23.109664Z
Blankenese,08.10.2025 16:00,Sauerstoffkonzentration,6.4,mg/l,2025-10-09T04:01:23.109664Z
Blankenese,08.10.2025 16:00,Trübung,161.9,FNU,2025-10-09T04:01:23.109664Z
Bunthaus,09.10.2025 06:40,Chlorophyll Kieselalgen,14.6,µg/l,2025-10-09T07:00:45.981992Z
Bunthaus,09.10.2025 06:40,Chlorophyll Grünalgen,21.1,µg/l,2025-10-09T07:00:45.981992Z
Bunthaus,09.10.2025 06:40,Chlorophyll (gesamt),41.4,µg/l,2025-10-09T07:00:45.981992Z
Bunthaus,09.10.2025 07:00,Wassertemperatur,13.4,°C,2025-10-09T07:00:45.981992Z
Bunthaus,09.10.2025 07:00,pH-Wert,7.8,ohne,2025-10-09T07:00:45.981992Z
Bunthaus,09.10.2025 07:00,Sauerstoffkonzentration,8.8,mg/l,2025-10-09T07:00:45.981992Z
Bunthaus,09.10.2025 07:00,Trübung,19.4,FNU,2025-10-09T07:00:45.981992Z
Bunthaus,09.10.2025 07:00,Sauerstoffsättigung,84.9,%,2025-10-09T07:00:45.981992Z
Blankenese,09.10.2025 07:00,Wassertemperatur,14.4,°C,2025-10-09T07:00:46.280717Z
Blankenese,09.10.2025 07:00,Trübung,47.1,FNU,2025-10-09T07:00:46.280717Z
Blankenese,09.10.2025 07:00,Sauerstoffsättigung,62.6,%,2025-10-09T07:00:46.280717Z
Blankenese,09.10.2025 07:00,Sauerstoffkonzentration,6.3,mg/l,2025-10-09T07:00:46.280717Z
Blankenese,09.10.2025 07:00,pH-Wert,7.7,ohne,2025-10-09T07:00:46.280717Z
Bunthaus,09.10.2025 06:40,Chlorophyll Kieselalgen,14.6,µg/l,2025-10-09T10:00:41.394243Z
Bunthaus,09.10.2025 06:40,Chlorophyll Grünalgen,21.1,µg/l,2025-10-09T10:00:41.394243Z
Bunthaus,09.10.2025 06:40,Chlorophyll (gesamt),41.4,µg/l,2025-10-09T10:00:41.394243Z
Bunthaus,09.10.2025 07:00,Wassertemperatur,13.4,°C,2025-10-09T10:00:41.394243Z
Bunthaus,09.10.2025 07:00,pH-Wert,7.8,ohne,2025-10-09T10:00:41.394243Z
Bunthaus,09.10.2025 07:00,Sauerstoffkonzentration,8.8,mg/l,2025-10-09T10:00:41.394243Z
Bunthaus,09.10.2025 07:00,Trübung,19.4,FNU,2025-10-09T10:00:41.394243Z
Bunthaus,09.10.2025 07:00,Sauerstoffsättigung,84.9,%,2025-10-09T10:00:41.394243Z
Blankenese,09.10.2025 07:00,Wassertemperatur,14.4,°C,2025-10-09T10:00:41.947077Z
Blankenese,09.10.2025 07:00,Trübung,47.1,FNU,2025-10-09T10:00:41.947077Z
Blankenese,09.10.2025 07:00,Sauerstoffsättigung,62.6,%,2025-10-09T10:00:41.947077Z
Blankenese,09.10.2025 07:00,Sauerstoffkonzentration,6.3,mg/l,2025-10-09T10:00:41.947077Z
Blankenese,09.10.2025 07:00,pH-Wert,7.7,ohne,2025-10-09T10:00:41.947077Z
Bunthaus,09.10.2025 11:00,Chlorophyll Grünalgen,24.5,µg/l,2025-10-09T13:00:53.359322Z
Bunthaus,09.10.2025 11:00,Chlorophyll (gesamt),54.0,µg/l,2025-10-09T13:00:53.359322Z
Bunthaus,09.10.2025 11:00,Chlorophyll Kieselalgen,24.2,µg/l,2025-10-09T13:00:53.359322Z
Bunthaus,09.10.2025 12:00,Trübung,13.0,FNU,2025-10-09T13:00:53.359322Z
Bunthaus,09.10.2025 12:00,Sauerstoffkonzentration,10.2,mg/l,2025-10-09T13:00:53.359322Z
Bunthaus,09.10.2025 12:00,Sauerstoffsättigung,97.9,%,2025-10-09T13:00:53.359322Z
Bunthaus,09.10.2025 12:00,Wassertemperatur,13.2,°C,2025-10-09T13:00:53.359322Z
Bunthaus,09.10.2025 12:00,pH-Wert,8.0,ohne,2025-10-09T13:00:53.359322Z
Blankenese,09.10.2025 12:00,pH-Wert,7.8,ohne,2025-10-09T13:00:54.517583Z
Blankenese,09.10.2025 12:00,Trübung,40.3,FNU,2025-10-09T13:00:54.517583Z
Blankenese,09.10.2025 12:00,Sauerstoffkonzentration,6.5,mg/l,2025-10-09T13:00:54.517583Z
Blankenese,09.10.2025 12:00,Sauerstoffsättigung,63.7,%,2025-10-09T13:00:54.517583Z
Blankenese,09.10.2025 12:00,Wassertemperatur,14.3,°C,2025-10-09T13:00:54.517583Z
Bunthaus,09.10.2025 15:30,Chlorophyll (gesamt),59.6,µg/l,2025-10-09T16:00:45.183715Z
Bunthaus,09.10.2025 15:30,Chlorophyll Grünalgen,27.3,µg/l,2025-10-09T16:00:45.183715Z
Bunthaus,09.10.2025 15:30,Chlorophyll Kieselalgen,27.3,µg/l,2025-10-09T16:00:45.183715Z
Bunthaus,09.10.2025 16:00,pH-Wert,8.0,ohne,2025-10-09T16:00:45.183715Z
Bunthaus,09.10.2025 16:00,Sauerstoffsättigung,101.1,%,2025-10-09T16:00:45.183715Z
Bunthaus,09.10.2025 16:00,Wassertemperatur,13.3,°C,2025-10-09T16:00:45.183715Z
Bunthaus,09.10.2025 16:00,Trübung,11.6,FNU,2025-10-09T16:00:45.183715Z
Bunthaus,09.10.2025 16:00,Sauerstoffkonzentration,10.5,mg/l,2025-10-09T16:00:45.183715Z
Blankenese,09.10.2025 16:00,Sauerstoffsättigung,63.1,%,2025-10-09T16:00:46.638570Z
Blankenese,09.10.2025 16:00,Wassertemperatur,14.4,°C,2025-10-09T16:00:46.638570Z
Blankenese,09.10.2025 16:00,Trübung,103.3,FNU,2025-10-09T16:00:46.638570Z
Blankenese,09.10.2025 16:00,pH-Wert,7.7,ohne,2025-10-09T16:00:46.638570Z
Blankenese,09.10.2025 16:00,Sauerstoffkonzentration,6.4,mg/l,2025-10-09T16:00:46.638570Z
Bunthaus,09.10.2025 15:30,Chlorophyll (gesamt),59.6,µg/l,2025-10-09T19:00:25.161144Z
Bunthaus,09.10.2025 15:30,Chlorophyll Grünalgen,27.3,µg/l,2025-10-09T19:00:25.161144Z
Bunthaus,09.10.2025 15:30,Chlorophyll Kieselalgen,27.3,µg/l,2025-10-09T19:00:25.161144Z
Bunthaus,09.10.2025 16:00,pH-Wert,8.0,ohne,2025-10-09T19:00:25.161144Z
Bunthaus,09.10.2025 16:00,Sauerstoffsättigung,101.1,%,2025-10-09T19:00:25.161144Z
Bunthaus,09.10.2025 16:00,Wassertemperatur,13.3,°C,2025-10-09T19:00:25.161144Z
Bunthaus,09.10.2025 16:00,Trübung,11.6,FNU,2025-10-09T19:00:25.161144Z
Bunthaus,09.10.2025 16:00,Sauerstoffkonzentration,10.5,mg/l,2025-10-09T19:00:25.161144Z
Blankenese,09.10.2025 16:00,Sauerstoffsättigung,63.1,%,2025-10-09T19:00:25.919736Z
Blankenese,09.10.2025 16:00,Wassertemperatur,14.4,°C,2025-10-09T19:00:25.919736Z
Blankenese,09.10.2025 16:00,Trübung,103.3,FNU,2025-10-09T19:00:25.919736Z
Blankenese,09.10.2025 16:00,pH-Wert,7.7,ohne,2025-10-09T19:00:25.919736Z
Blankenese,09.10.2025 16:00,Sauerstoffkonzentration,6.4,mg/l,2025-10-09T19:00:25.919736Z
Bunthaus,09.10.2025 15:30,Chlorophyll (gesamt),59.6,µg/l,2025-10-09T22:01:34.112497Z
Bunthaus,09.10.2025 15:30,Chlorophyll Grünalgen,27.3,µg/l,2025-10-09T22:01:34.112497Z
Bunthaus,09.10.2025 15:30,Chlorophyll Kieselalgen,27.3,µg/l,2025-10-09T22:01:34.112497Z
Bunthaus,09.10.2025 16:00,pH-Wert,8.0,ohne,2025-10-09T22:01:34.112497Z
Bunthaus,09.10.2025 16:00,Sauerstoffsättigung,101.1,%,2025-10-09T22:01:34.112497Z
Bunthaus,09.10.2025 16:00,Wassertemperatur,13.3,°C,2025-10-09T22:01:34.112497Z
Bunthaus,09.10.2025 16:00,Trübung,11.6,FNU,2025-10-09T22:01:34.112497Z
Bunthaus,09.10.2025 16:00,Sauerstoffkonzentration,10.5,mg/l,2025-10-09T22:01:34.112497Z
Blankenese,09.10.2025 16:00,Sauerstoffsättigung,63.1,%,2025-10-09T22:01:35.217098Z
Blankenese,09.10.2025 16:00,Wassertemperatur,14.4,°C,2025-10-09T22:01:35.217098Z
Blankenese,09.10.2025 16:00,Trübung,103.3,FNU,2025-10-09T22:01:35.217098Z
Blankenese,09.10.2025 16:00,pH-Wert,7.7,ohne,2025-10-09T22:01:35.217098Z
Blankenese,09.10.2025 16:00,Sauerstoffkonzentration,6.4,mg/l,2025-10-09T22:01:35.217098Z
Bunthaus,09.10.2025 15:30,Chlorophyll (gesamt),59.6,µg/l,2025-10-10T04:02:08.792595Z
Bunthaus,09.10.2025 15:30,Chlorophyll Grünalgen,27.3,µg/l,2025-10-10T04:02:08.792595Z
Bunthaus,09.10.2025 15:30,Chlorophyll Kieselalgen,27.3,µg/l,2025-10-10T04:02:08.792595Z
Bunthaus,09.10.2025 16:00,pH-Wert,8.0,ohne,2025-10-10T04:02:08.792595Z
Bunthaus,09.10.2025 16:00,Sauerstoffsättigung,101.1,%,2025-10-10T04:02:08.792595Z
Bunthaus,09.10.2025 16:00,Wassertemperatur,13.3,°C,2025-10-10T04:02:08.792595Z
Bunthaus,09.10.2025 16:00,Trübung,11.6,FNU,2025-10-10T04:02:08.792595Z
Bunthaus,09.10.2025 16:00,Sauerstoffkonzentration,10.5,mg/l,2025-10-10T04:02:08.792595Z
Blankenese,09.10.2025 16:00,Sauerstoffsättigung,63.1,%,2025-10-10T04:02:09.191047Z
Blankenese,09.10.2025 16:00,Wassertemperatur,14.4,°C,2025-10-10T04:02:09.191047Z
Blankenese,09.10.2025 16:00,Trübung,103.3,FNU,2025-10-10T04:02:09.191047Z
Blankenese,09.10.2025 16:00,pH-Wert,7.7,ohne,2025-10-10T04:02:09.191047Z
Blankenese,09.10.2025 16:00,Sauerstoffkonzentration,6.4,mg/l,2025-10-10T04:02:09.191047Z
Bunthaus,10.10.2025 06:50,Chlorophyll (gesamt),37.1,µg/l,2025-10-10T07:00:34.093218Z
Bunthaus,10.10.2025 06:50,Chlorophyll Kieselalgen,12.0,µg/l,2025-10-10T07:00:34.093218Z
Bunthaus,10.10.2025 06:50,Chlorophyll Grünalgen,19.8,µg/l,2025-10-10T07:00:34.093218Z
Bunthaus,10.10.2025 07:00,Trübung,22.6,FNU,2025-10-10T07:00:34.093218Z
Bunthaus,10.10.2025 07:00,Wassertemperatur,13.5,°C,2025-10-10T07:00:34.093218Z
Bunthaus,10.10.2025 07:00,pH-Wert,7.8,ohne,2025-10-10T07:00:34.093218Z
Bunthaus,10.10.2025 07:00,Sauerstoffkonzentration,9.1,mg/l,2025-10-10T07:00:34.093218Z
Bunthaus,10.10.2025 07:00,Sauerstoffsättigung,87.4,%,2025-10-10T07:00:34.093218Z
Blankenese,10.10.2025 07:00,Sauerstoffkonzentration,6.4,mg/l,2025-10-10T07:00:34.543741Z
Blankenese,10.10.2025 07:00,Trübung,38.7,FNU,2025-10-10T07:00:34.543741Z
Blankenese,10.10.2025 07:00,Sauerstoffsättigung,63.6,%,2025-10-10T07:00:34.543741Z
Blankenese,10.10.2025 07:00,Wassertemperatur,14.4,°C,2025-10-10T07:00:34.543741Z
Blankenese,10.10.2025 07:00,pH-Wert,7.7,ohne,2025-10-10T07:00:34.543741Z
Bunthaus,10.10.2025 06:50,Chlorophyll (gesamt),37.1,µg/l,2025-10-10T10:01:10.903820Z
Bunthaus,10.10.2025 06:50,Chlorophyll Kieselalgen,12.0,µg/l,2025-10-10T10:01:10.903820Z
Bunthaus,10.10.2025 06:50,Chlorophyll Grünalgen,19.8,µg/l,2025-10-10T10:01:10.903820Z
Bunthaus,10.10.2025 07:00,Trübung,22.6,FNU,2025-10-10T10:01:10.903820Z
Bunthaus,10.10.2025 07:00,Wassertemperatur,13.5,°C,2025-10-10T10:01:10.903820Z
Bunthaus,10.10.2025 07:00,pH-Wert,7.8,ohne,2025-10-10T10:01:10.903820Z
Bunthaus,10.10.2025 07:00,Sauerstoffkonzentration,9.1,mg/l,2025-10-10T10:01:10.903820Z
Bunthaus,10.10.2025 07:00,Sauerstoffsättigung,87.4,%,2025-10-10T10:01:10.903820Z
Blankenese,10.10.2025 07:00,Sauerstoffkonzentration,6.4,mg/l,2025-10-10T10:01:12.011666Z
Blankenese,10.10.2025 07:00,Trübung,38.7,FNU,2025-10-10T10:01:12.011666Z
Blankenese,10.10.2025 07:00,Sauerstoffsättigung,63.6,%,2025-10-10T10:01:12.011666Z
Blankenese,10.10.2025 07:00,Wassertemperatur,14.4,°C,2025-10-10T10:01:12.011666Z
Blankenese,10.10.2025 07:00,pH-Wert,7.7,ohne,2025-10-10T10:01:12.011666Z
Bunthaus,10.10.2025 11:10,Chlorophyll Grünalgen,22.9,µg/l,2025-10-10T13:00:43.584130Z
Bunthaus,10.10.2025 11:10,Chlorophyll (gesamt),46.4,µg/l,2025-10-10T13:00:43.584130Z
Bunthaus,10.10.2025 11:10,Chlorophyll Kieselalgen,17.8,µg/l,2025-10-10T13:00:43.584130Z
Bunthaus,10.10.2025 12:00,Trübung,11.7,FNU,2025-10-10T13:00:43.584130Z
Bunthaus,10.10.2025 12:00,Sauerstoffkonzentration,10.0,mg/l,2025-10-10T13:00:43.584130Z
Bunthaus,10.10.2025 12:00,pH-Wert,7.9,ohne,2025-10-10T13:00:43.584130Z
Bunthaus,10.10.2025 12:00,Wassertemperatur,13.3,°C,2025-10-10T13:00:43.584130Z
Bunthaus,10.10.2025 12:00,Sauerstoffsättigung,95.9,%,2025-10-10T13:00:43.584130Z
Blankenese,10.10.2025 12:00,pH-Wert,7.7,ohne,2025-10-10T13:00:44.695482Z
Blankenese,10.10.2025 12:00,Wassertemperatur,14.2,°C,2025-10-10T13:00:44.695482Z
Blankenese,10.10.2025 12:00,Sauerstoffkonzentration,6.6,mg/l,2025-10-10T13:00:44.695482Z
Blankenese,10.10.2025 12:00,Trübung,58.3,FNU,2025-10-10T13:00:44.695482Z
Blankenese,10.10.2025 12:00,Sauerstoffsättigung,64.8,%,2025-10-10T13:00:44.695482Z
Bunthaus,10.10.2025 15:40,Chlorophyll (gesamt),54.3,µg/l,2025-10-10T16:01:35.520959Z
Bunthaus,10.10.2025 15:40,Chlorophyll Kieselalgen,23.5,µg/l,2025-10-10T16:01:35.520959Z
Bunthaus,10.10.2025 15:40,Chlorophyll Grünalgen,25.7,µg/l,2025-10-10T16:01:35.520959Z
Bunthaus,10.10.2025 16:00,Trübung,11.0,FNU,2025-10-10T16:01:35.520959Z
Bunthaus,10.10.2025 16:00,Sauerstoffkonzentration,10.4,mg/l,2025-10-10T16:01:35.520959Z
Bunthaus,10.10.2025 16:00,Wassertemperatur,13.6,°C,2025-10-10T16:01:35.520959Z
Bunthaus,10.10.2025 16:00,pH-Wert,8.0,ohne,2025-10-10T16:01:35.520959Z
Bunthaus,10.10.2025 16:00,Sauerstoffsättigung,100.8,%,2025-10-10T16:01:35.520959Z
Blankenese,10.10.2025 16:00,pH-Wert,7.7,ohne,2025-10-10T16:01:36.554717Z
Blankenese,10.10.2025 16:00,Sauerstoffkonzentration,6.5,mg/l,2025-10-10T16:01:36.554717Z
Blankenese,10.10.2025 16:00,Trübung,72.8,FNU,2025-10-10T16:01:36.554717Z
Blankenese,10.10.2025 16:00,Wassertemperatur,14.2,°C,2025-10-10T16:01:36.554717Z
Blankenese,10.10.2025 16:00,Sauerstoffsättigung,64.3,%,2025-10-10T16:01:36.554717Z
Bunthaus,10.10.2025 15:40,Chlorophyll (gesamt),54.3,µg/l,2025-10-10T22:01:09.280415Z
Bunthaus,10.10.2025 15:40,Chlorophyll Kieselalgen,23.5,µg/l,2025-10-10T22:01:09.280415Z
Bunthaus,10.10.2025 15:40,Chlorophyll Grünalgen,25.7,µg/l,2025-10-10T22:01:09.280415Z
Bunthaus,10.10.2025 16:00,Trübung,11.0,FNU,2025-10-10T22:01:09.280415Z
Bunthaus,10.10.2025 16:00,Sauerstoffkonzentration,10.4,mg/l,2025-10-10T22:01:09.280415Z
Bunthaus,10.10.2025 16:00,Wassertemperatur,13.6,°C,2025-10-10T22:01:09.280415Z
Bunthaus,10.10.2025 16:00,pH-Wert,8.0,ohne,2025-10-10T22:01:09.280415Z
Bunthaus,10.10.2025 16:00,Sauerstoffsättigung,100.8,%,2025-10-10T22:01:09.280415Z
Blankenese,10.10.2025 16:00,pH-Wert,7.7,ohne,2025-10-10T22:01:10.603662Z
Blankenese,10.10.2025 16:00,Sauerstoffkonzentration,6.5,mg/l,2025-10-10T22:01:10.603662Z
Blankenese,10.10.2025 16:00,Trübung,72.8,FNU,2025-10-10T22:01:10.603662Z
Blankenese,10.10.2025 16:00,Wassertemperatur,14.2,°C,2025-10-10T22:01:10.603662Z
Blankenese,10.10.2025 16:00,Sauerstoffsättigung,64.3,%,2025-10-10T22:01:10.603662Z
Bunthaus,10.10.2025 15:40,Chlorophyll (gesamt),54.3,µg/l,2025-10-11T01:01:00.334347Z
Bunthaus,10.10.2025 15:40,Chlorophyll Kieselalgen,23.5,µg/l,2025-10-11T01:01:00.334347Z
Bunthaus,10.10.2025 15:40,Chlorophyll Grünalgen,25.7,µg/l,2025-10-11T01:01:00.334347Z
Bunthaus,10.10.2025 16:00,Trübung,11.0,FNU,2025-10-11T01:01:00.334347Z
Bunthaus,10.10.2025 16:00,Sauerstoffkonzentration,10.4,mg/l,2025-10-11T01:01:00.334347Z
Bunthaus,10.10.2025 16:00,Wassertemperatur,13.6,°C,2025-10-11T01:01:00.334347Z
Bunthaus,10.10.2025 16:00,pH-Wert,8.0,ohne,2025-10-11T01:01:00.334347Z
Bunthaus,10.10.2025 16:00,Sauerstoffsättigung,100.8,%,2025-10-11T01:01:00.334347Z
Blankenese,10.10.2025 16:00,pH-Wert,7.7,ohne,2025-10-11T01:01:01.088879Z
Blankenese,10.10.2025 16:00,Sauerstoffkonzentration,6.5,mg/l,2025-10-11T01:01:01.088879Z
Blankenese,10.10.2025 16:00,Trübung,72.8,FNU,2025-10-11T01:01:01.088879Z
Blankenese,10.10.2025 16:00,Wassertemperatur,14.2,°C,2025-10-11T01:01:01.088879Z
Blankenese,10.10.2025 16:00,Sauerstoffsättigung,64.3,%,2025-10-11T01:01:01.088879Z
Bunthaus,10.10.2025 15:40,Chlorophyll (gesamt),54.3,µg/l,2025-10-11T04:01:30.601137Z
Bunthaus,10.10.2025 15:40,Chlorophyll Kieselalgen,23.5,µg/l,2025-10-11T04:01:30.601137Z
Bunthaus,10.10.2025 15:40,Chlorophyll Grünalgen,25.7,µg/l,2025-10-11T04:01:30.601137Z
Bunthaus,10.10.2025 16:00,Trübung,11.0,FNU,2025-10-11T04:01:30.601137Z
Bunthaus,10.10.2025 16:00,Sauerstoffkonzentration,10.4,mg/l,2025-10-11T04:01:30.601137Z
Bunthaus,10.10.2025 16:00,Wassertemperatur,13.6,°C,2025-10-11T04:01:30.601137Z
Bunthaus,10.10.2025 16:00,pH-Wert,8.0,ohne,2025-10-11T04:01:30.601137Z
Bunthaus,10.10.2025 16:00,Sauerstoffsättigung,100.8,%,2025-10-11T04:01:30.601137Z
Blankenese,10.10.2025 16:00,pH-Wert,7.7,ohne,2025-10-11T04:01:32.180259Z
Blankenese,10.10.2025 16:00,Sauerstoffkonzentration,6.5,mg/l,2025-10-11T04:01:32.180259Z
Blankenese,10.10.2025 16:00,Trübung,72.8,FNU,2025-10-11T04:01:32.180259Z
Blankenese,10.10.2025 16:00,Wassertemperatur,14.2,°C,2025-10-11T04:01:32.180259Z
Blankenese,10.10.2025 16:00,Sauerstoffsättigung,64.3,%,2025-10-11T04:01:32.180259Z
Bunthaus,11.10.2025 07:00,Sauerstoffsättigung,94.5,%,2025-10-11T07:01:20.874367Z
Bunthaus,11.10.2025 07:00,Sauerstoffkonzentration,9.8,mg/l,2025-10-11T07:01:20.874367Z
Bunthaus,11.10.2025 07:00,Chlorophyll Kieselalgen,17.9,µg/l,2025-10-11T07:01:20.874367Z
Bunthaus,11.10.2025 07:00,Chlorophyll Grünalgen,23.8,µg/l,2025-10-11T07:01:20.874367Z
Bunthaus,11.10.2025 07:00,Chlorophyll (gesamt),47.4,µg/l,2025-10-11T07:01:20.874367Z
Bunthaus,11.10.2025 07:00,Wassertemperatur,13.6,°C,2025-10-11T07:01:20.874367Z
Bunthaus,11.10.2025 07:00,Trübung,15.5,FNU,2025-10-11T07:01:20.874367Z
Bunthaus,11.10.2025 07:00,pH-Wert,7.9,ohne,2025-10-11T07:01:20.874367Z
Blankenese,11.10.2025 07:00,Wassertemperatur,14.3,°C,2025-10-11T07:01:22.224934Z
Blankenese,11.10.2025 07:00,Sauerstoffkonzentration,6.6,mg/l,2025-10-11T07:01:22.224934Z
Blankenese,11.10.2025 07:00,Trübung,96.0,FNU,2025-10-11T07:01:22.224934Z
Blankenese,11.10.2025 07:00,pH-Wert,7.7,ohne,2025-10-11T07:01:22.224934Z
Blankenese,11.10.2025 07:00,Sauerstoffsättigung,65.2,%,2025-10-11T07:01:22.224934Z
Bunthaus,11.10.2025 07:00,Sauerstoffsättigung,94.5,%,2025-10-11T10:01:01.473028Z
Bunthaus,11.10.2025 07:00,Sauerstoffkonzentration,9.8,mg/l,2025-10-11T10:01:01.473028Z
Bunthaus,11.10.2025 07:00,Chlorophyll Kieselalgen,17.9,µg/l,2025-10-11T10:01:01.473028Z
Bunthaus,11.10.2025 07:00,Chlorophyll Grünalgen,23.8,µg/l,2025-10-11T10:01:01.473028Z
Bunthaus,11.10.2025 07:00,Chlorophyll (gesamt),47.4,µg/l,2025-10-11T10:01:01.473028Z
Bunthaus,11.10.2025 07:00,Wassertemperatur,13.6,°C,2025-10-11T10:01:01.473028Z
Bunthaus,11.10.2025 07:00,Trübung,15.5,FNU,2025-10-11T10:01:01.473028Z
Bunthaus,11.10.2025 07:00,pH-Wert,7.9,ohne,2025-10-11T10:01:01.473028Z
Blankenese,11.10.2025 07:00,Wassertemperatur,14.3,°C,2025-10-11T10:01:02.452019Z
Blankenese,11.10.2025 07:00,Sauerstoffkonzentration,6.6,mg/l,2025-10-11T10:01:02.452019Z
Blankenese,11.10.2025 07:00,Trübung,96.0,FNU,2025-10-11T10:01:02.452019Z
Blankenese,11.10.2025 07:00,pH-Wert,7.7,ohne,2025-10-11T10:01:02.452019Z
Blankenese,11.10.2025 07:00,Sauerstoffsättigung,65.2,%,2025-10-11T10:01:02.452019Z
Bunthaus,11.10.2025 11:20,Chlorophyll Kieselalgen,16.5,µg/l,2025-10-11T13:01:30.020905Z
Bunthaus,11.10.2025 11:20,Chlorophyll Grünalgen,22.2,µg/l,2025-10-11T13:01:30.020905Z
Bunthaus,11.10.2025 11:20,Chlorophyll (gesamt),43.8,µg/l,2025-10-11T13:01:30.020905Z
Bunthaus,11.10.2025 12:00,Sauerstoffkonzentration,9.8,mg/l,2025-10-11T13:01:30.020905Z
Bunthaus,11.10.2025 12:00,pH-Wert,7.9,ohne,2025-10-11T13:01:30.020905Z
Bunthaus,11.10.2025 12:00,Sauerstoffsättigung,94.9,%,2025-10-11T13:01:30.020905Z
Bunthaus,11.10.2025 12:00,Wassertemperatur,13.6,°C,2025-10-11T13:01:30.020905Z
Bunthaus,11.10.2025 12:00,Trübung,15.5,FNU,2025-10-11T13:01:30.020905Z
Blankenese,11.10.2025 12:00,Sauerstoffkonzentration,6.7,mg/l,2025-10-11T13:01:31.608157Z
Blankenese,11.10.2025 12:00,pH-Wert,7.8,ohne,2025-10-11T13:01:31.608157Z
Blankenese,11.10.2025 12:00,Trübung,65.2,FNU,2025-10-11T13:01:31.608157Z
Blankenese,11.10.2025 12:00,Wassertemperatur,14.2,°C,2025-10-11T13:01:31.608157Z
Blankenese,11.10.2025 12:00,Sauerstoffsättigung,66.3,%,2025-10-11T13:01:31.608157Z
Bunthaus,11.10.2025 15:50,Chlorophyll Grünalgen,25.3,µg/l,2025-10-11T16:01:03.483818Z
Bunthaus,11.10.2025 15:50,Chlorophyll (gesamt),51.0,µg/l,2025-10-11T16:01:03.483818Z
Bunthaus,11.10.2025 15:50,Chlorophyll Kieselalgen,21.5,µg/l,2025-10-11T16:01:03.483818Z
Bunthaus,11.10.2025 16:00,Wassertemperatur,13.8,°C,2025-10-11T16:01:03.483818Z
Bunthaus,11.10.2025 16:00,Trübung,10.7,FNU,2025-10-11T16:01:03.483818Z
Bunthaus,11.10.2025 16:00,Sauerstoffkonzentration,10.4,mg/l,2025-10-11T16:01:03.483818Z
Bunthaus,11.10.2025 16:00,Sauerstoffsättigung,101.0,%,2025-10-11T16:01:03.483818Z
Bunthaus,11.10.2025 16:00,pH-Wert,8.0,ohne,2025-10-11T16:01:03.483818Z
Blankenese,11.10.2025 16:00,pH-Wert,7.8,ohne,2025-10-11T16:01:04.676009Z
Blankenese,11.10.2025 16:00,Sauerstoffsättigung,66.5,%,2025-10-11T16:01:04.676009Z
Blankenese,11.10.2025 16:00,Trübung,64.9,FNU,2025-10-11T16:01:04.676009Z
Blankenese,11.10.2025 16:00,Sauerstoffkonzentration,6.8,mg/l,2025-10-11T16:01:04.676009Z
Blankenese,11.10.2025 16:00,Wassertemperatur,14.1,°C,2025-10-11T16:01:04.676009Z
Bunthaus,11.10.2025 15:50,Chlorophyll Grünalgen,25.3,µg/l,2025-10-11T19:00:57.624660Z
Bunthaus,11.10.2025 15:50,Chlorophyll (gesamt),51.0,µg/l,2025-10-11T19:00:57.624660Z
Bunthaus,11.10.2025 15:50,Chlorophyll Kieselalgen,21.5,µg/l,2025-10-11T19:00:57.624660Z
Bunthaus,11.10.2025 16:00,Wassertemperatur,13.8,°C,2025-10-11T19:00:57.624660Z
Bunthaus,11.10.2025 16:00,Trübung,10.7,FNU,2025-10-11T19:00:57.624660Z
Bunthaus,11.10.2025 16:00,Sauerstoffkonzentration,10.4,mg/l,2025-10-11T19:00:57.624660Z
Bunthaus,11.10.2025 16:00,Sauerstoffsättigung,101.0,%,2025-10-11T19:00:57.624660Z
Bunthaus,11.10.2025 16:00,pH-Wert,8.0,ohne,2025-10-11T19:00:57.624660Z
Blankenese,11.10.2025 16:00,pH-Wert,7.8,ohne,2025-10-11T19:00:58.381855Z
Blankenese,11.10.2025 16:00,Sauerstoffsättigung,66.5,%,2025-10-11T19:00:58.381855Z
Blankenese,11.10.2025 16:00,Trübung,64.9,FNU,2025-10-11T19:00:58.381855Z
Blankenese,11.10.2025 16:00,Sauerstoffkonzentration,6.8,mg/l,2025-10-11T19:00:58.381855Z
Blankenese,11.10.2025 16:00,Wassertemperatur,14.1,°C,2025-10-11T19:00:58.381855Z
Bunthaus,11.10.2025 15:50,Chlorophyll Grünalgen,25.3,µg/l,2025-10-11T22:00:57.781690Z
Bunthaus,11.10.2025 15:50,Chlorophyll (gesamt),51.0,µg/l,2025-10-11T22:00:57.781690Z
Bunthaus,11.10.2025 15:50,Chlorophyll Kieselalgen,21.5,µg/l,2025-10-11T22:00:57.781690Z
Bunthaus,11.10.2025 16:00,Wassertemperatur,13.8,°C,2025-10-11T22:00:57.781690Z
Bunthaus,11.10.2025 16:00,Trübung,10.7,FNU,2025-10-11T22:00:57.781690Z
Bunthaus,11.10.2025 16:00,Sauerstoffkonzentration,10.4,mg/l,2025-10-11T22:00:57.781690Z
Bunthaus,11.10.2025 16:00,Sauerstoffsättigung,101.0,%,2025-10-11T22:00:57.781690Z
Bunthaus,11.10.2025 16:00,pH-Wert,8.0,ohne,2025-10-11T22:00:57.781690Z
Blankenese,11.10.2025 16:00,pH-Wert,7.8,ohne,2025-10-11T22:00:58.708900Z
Blankenese,11.10.2025 16:00,Sauerstoffsättigung,66.5,%,2025-10-11T22:00:58.708900Z
Blankenese,11.10.2025 16:00,Trübung,64.9,FNU,2025-10-11T22:00:58.708900Z
Blankenese,11.10.2025 16:00,Sauerstoffkonzentration,6.8,mg/l,2025-10-11T22:00:58.708900Z
Blankenese,11.10.2025 16:00,Wassertemperatur,14.1,°C,2025-10-11T22:00:58.708900Z
Bunthaus,11.10.2025 15:50,Chlorophyll Grünalgen,25.3,µg/l,2025-10-12T01:01:01.766603Z
Bunthaus,11.10.2025 15:50,Chlorophyll (gesamt),51.0,µg/l,2025-10-12T01:01:01.766603Z
Bunthaus,11.10.2025 15:50,Chlorophyll Kieselalgen,21.5,µg/l,2025-10-12T01:01:01.766603Z
Bunthaus,11.10.2025 16:00,Wassertemperatur,13.8,°C,2025-10-12T01:01:01.766603Z
Bunthaus,11.10.2025 16:00,Trübung,10.7,FNU,2025-10-12T01:01:01.766603Z
Bunthaus,11.10.2025 16:00,Sauerstoffkonzentration,10.4,mg/l,2025-10-12T01:01:01.766603Z
Bunthaus,11.10.2025 16:00,Sauerstoffsättigung,101.0,%,2025-10-12T01:01:01.766603Z
Bunthaus,11.10.2025 16:00,pH-Wert,8.0,ohne,2025-10-12T01:01:01.766603Z
Blankenese,11.10.2025 16:00,pH-Wert,7.8,ohne,2025-10-12T01:01:02.830420Z
Blankenese,11.10.2025 16:00,Sauerstoffsättigung,66.5,%,2025-10-12T01:01:02.830420Z
Blankenese,11.10.2025 16:00,Trübung,64.9,FNU,2025-10-12T01:01:02.830420Z
Blankenese,11.10.2025 16:00,Sauerstoffkonzentration,6.8,mg/l,2025-10-12T01:01:02.830420Z
Blankenese,11.10.2025 16:00,Wassertemperatur,14.1,°C,2025-10-12T01:01:02.830420Z
Bunthaus,11.10.2025 15:50,Chlorophyll Grünalgen,25.3,µg/l,2025-10-12T04:00:35.226611Z
Bunthaus,11.10.2025 15:50,Chlorophyll (gesamt),51.0,µg/l,2025-10-12T04:00:35.226611Z
Bunthaus,11.10.2025 15:50,Chlorophyll Kieselalgen,21.5,µg/l,2025-10-12T04:00:35.226611Z
Bunthaus,11.10.2025 16:00,Wassertemperatur,13.8,°C,2025-10-12T04:00:35.226611Z
Bunthaus,11.10.2025 16:00,Trübung,10.7,FNU,2025-10-12T04:00:35.226611Z
Bunthaus,11.10.2025 16:00,Sauerstoffkonzentration,10.4,mg/l,2025-10-12T04:00:35.226611Z
Bunthaus,11.10.2025 16:00,Sauerstoffsättigung,101.0,%,2025-10-12T04:00:35.226611Z
Bunthaus,11.10.2025 16:00,pH-Wert,8.0,ohne,2025-10-12T04:00:35.226611Z
Blankenese,11.10.2025 16:00,pH-Wert,7.8,ohne,2025-10-12T04:00:35.547065Z
Blankenese,11.10.2025 16:00,Sauerstoffsättigung,66.5,%,2025-10-12T04:00:35.547065Z
Blankenese,11.10.2025 16:00,Trübung,64.9,FNU,2025-10-12T04:00:35.547065Z
Blankenese,11.10.2025 16:00,Sauerstoffkonzentration,6.8,mg/l,2025-10-12T04:00:35.547065Z
Blankenese,11.10.2025 16:00,Wassertemperatur,14.1,°C,2025-10-12T04:00:35.547065Z
Bunthaus,12.10.2025 06:00,Chlorophyll Kieselalgen,18.2,µg/l,2025-10-12T07:00:56.051129Z
Bunthaus,12.10.2025 06:00,Chlorophyll Grünalgen,24.3,µg/l,2025-10-12T07:00:56.051129Z
Bunthaus,12.10.2025 06:00,Chlorophyll (gesamt),47.1,µg/l,2025-10-12T07:00:56.051129Z
Bunthaus,12.10.2025 07:00,Sauerstoffkonzentration,10.0,mg/l,2025-10-12T07:00:56.051129Z
Bunthaus,12.10.2025 07:00,Trübung,12.5,FNU,2025-10-12T07:00:56.051129Z
Bunthaus,12.10.2025 07:00,Sauerstoffsättigung,96.6,%,2025-10-12T07:00:56.051129Z
Bunthaus,12.10.2025 07:00,pH-Wert,7.9,ohne,2025-10-12T07:00:56.051129Z
Bunthaus,12.10.2025 07:00,Wassertemperatur,13.8,°C,2025-10-12T07:00:56.051129Z
Blankenese,12.10.2025 07:00,Sauerstoffsättigung,65.7,%,2025-10-12T07:00:56.796651Z
Blankenese,12.10.2025 07:00,Trübung,94.4,FNU,2025-10-12T07:00:56.796651Z
Blankenese,12.10.2025 07:00,Wassertemperatur,14.2,°C,2025-10-12T07:00:56.796651Z
Blankenese,12.10.2025 07:00,pH-Wert,7.7,ohne,2025-10-12T07:00:56.796651Z
Blankenese,12.10.2025 07:00,Sauerstoffkonzentration,6.7,mg/l,2025-10-12T07:00:56.796651Z
Bunthaus,12.10.2025 06:00,Chlorophyll Kieselalgen,18.2,µg/l,2025-10-12T10:01:13.445433Z
Bunthaus,12.10.2025 06:00,Chlorophyll Grünalgen,24.3,µg/l,2025-10-12T10:01:13.445433Z
Bunthaus,12.10.2025 06:00,Chlorophyll (gesamt),47.1,µg/l,2025-10-12T10:01:13.445433Z
Bunthaus,12.10.2025 07:00,Sauerstoffkonzentration,10.0,mg/l,2025-10-12T10:01:13.445433Z
Bunthaus,12.10.2025 07:00,Trübung,12.5,FNU,2025-10-12T10:01:13.445433Z
Bunthaus,12.10.2025 07:00,Sauerstoffsättigung,96.6,%,2025-10-12T10:01:13.445433Z
Bunthaus,12.10.2025 07:00,pH-Wert,7.9,ohne,2025-10-12T10:01:13.445433Z
Bunthaus,12.10.2025 07:00,Wassertemperatur,13.8,°C,2025-10-12T10:01:13.445433Z
Blankenese,12.10.2025 07:00,Sauerstoffsättigung,65.7,%,2025-10-12T10:01:14.605598Z
Blankenese,12.10.2025 07:00,Trübung,94.4,FNU,2025-10-12T10:01:14.605598Z
Blankenese,12.10.2025 07:00,Wassertemperatur,14.2,°C,2025-10-12T10:01:14.605598Z
Blankenese,12.10.2025 07:00,pH-Wert,7.7,ohne,2025-10-12T10:01:14.605598Z
Blankenese,12.10.2025 07:00,Sauerstoffkonzentration,6.7,mg/l,2025-10-12T10:01:14.605598Z
Bunthaus,12.10.2025 11:30,Chlorophyll (gesamt),38.9,µg/l,2025-10-12T13:01:07.207029Z
Bunthaus,12.10.2025 11:30,Chlorophyll Kieselalgen,13.2,µg/l,2025-10-12T13:01:07.207029Z
Bunthaus,12.10.2025 11:30,Chlorophyll Grünalgen,20.7,µg/l,2025-10-12T13:01:07.207029Z
Bunthaus,12.10.2025 12:00,pH-Wert,7.9,ohne,2025-10-12T13:01:07.207029Z
Bunthaus,12.10.2025 12:00,Sauerstoffsättigung,94.1,%,2025-10-12T13:01:07.207029Z
Bunthaus,12.10.2025 12:00,Wassertemperatur,13.7,°C,2025-10-12T13:01:07.207029Z
Bunthaus,12.10.2025 12:00,Sauerstoffkonzentration,9.7,mg/l,2025-10-12T13:01:07.207029Z
Bunthaus,12.10.2025 12:00,Trübung,13.0,FNU,2025-10-12T13:01:07.207029Z
Blankenese,12.10.2025 12:00,Sauerstoffkonzentration,6.8,mg/l,2025-10-12T13:01:08.124269Z
Blankenese,12.10.2025 12:00,pH-Wert,7.8,ohne,2025-10-12T13:01:08.124269Z
Blankenese,12.10.2025 12:00,Trübung,74.0,FNU,2025-10-12T13:01:08.124269Z
Blankenese,12.10.2025 12:00,Sauerstoffsättigung,67.0,%,2025-10-12T13:01:08.124269Z
Blankenese,12.10.2025 12:00,Wassertemperatur,14.1,°C,2025-10-12T13:01:08.124269Z
Bunthaus,12.10.2025 15:50,Chlorophyll Kieselalgen,19.6,µg/l,2025-10-12T16:01:17.428601Z
Bunthaus,12.10.2025 15:50,Chlorophyll Grünalgen,23.4,µg/l,2025-10-12T16:01:17.428601Z
Bunthaus,12.10.2025 15:50,Chlorophyll (gesamt),48.1,µg/l,2025-10-12T16:01:17.428601Z
Bunthaus,12.10.2025 16:00,Sauerstoffkonzentration,10.2,mg/l,2025-10-12T16:01:17.428601Z
Bunthaus,12.10.2025 16:00,Trübung,13.5,FNU,2025-10-12T16:01:17.428601Z
Bunthaus,12.10.2025 16:00,pH-Wert,7.9,ohne,2025-10-12T16:01:17.428601Z
Bunthaus,12.10.2025 16:00,Wassertemperatur,13.7,°C,2025-10-12T16:01:17.428601Z
Bunthaus,12.10.2025 16:00,Sauerstoffsättigung,99.1,%,2025-10-12T16:01:17.428601Z
Blankenese,12.10.2025 16:00,Sauerstoffsättigung,67.7,%,2025-10-12T16:01:18.179992Z
Blankenese,12.10.2025 16:00,pH-Wert,7.8,ohne,2025-10-12T16:01:18.179992Z
Blankenese,12.10.2025 16:00,Sauerstoffkonzentration,6.9,mg/l,2025-10-12T16:01:18.179992Z
Blankenese,12.10.2025 16:00,Trübung,39.6,FNU,2025-10-12T16:01:18.179992Z
Blankenese,12.10.2025 16:00,Wassertemperatur,14.0,°C,2025-10-12T16:01:18.179992Z
Bunthaus,12.10.2025 15:50,Chlorophyll Kieselalgen,19.6,µg/l,2025-10-12T19:00:59.759145Z
Bunthaus,12.10.2025 15:50,Chlorophyll Grünalgen,23.4,µg/l,2025-10-12T19:00:59.759145Z
Bunthaus,12.10.2025 15:50,Chlorophyll (gesamt),48.1,µg/l,2025-10-12T19:00:59.759145Z
Bunthaus,12.10.2025 16:00,Sauerstoffkonzentration,10.2,mg/l,2025-10-12T19:00:59.759145Z
Bunthaus,12.10.2025 16:00,Trübung,13.5,FNU,2025-10-12T19:00:59.759145Z
Bunthaus,12.10.2025 16:00,pH-Wert,7.9,ohne,2025-10-12T19:00:59.759145Z
Bunthaus,12.10.2025 16:00,Wassertemperatur,13.7,°C,2025-10-12T19:00:59.759145Z
Bunthaus,12.10.2025 16:00,Sauerstoffsättigung,99.1,%,2025-10-12T19:00:59.759145Z
Blankenese,12.10.2025 16:00,Sauerstoffsättigung,67.7,%,2025-10-12T19:01:00.723246Z
Blankenese,12.10.2025 16:00,pH-Wert,7.8,ohne,2025-10-12T19:01:00.723246Z
Blankenese,12.10.2025 16:00,Sauerstoffkonzentration,6.9,mg/l,2025-10-12T19:01:00.723246Z
Blankenese,12.10.2025 16:00,Trübung,39.6,FNU,2025-10-12T19:01:00.723246Z
Blankenese,12.10.2025 16:00,Wassertemperatur,14.0,°C,2025-10-12T19:01:00.723246Z
Bunthaus,12.10.2025 15:50,Chlorophyll Kieselalgen,19.6,µg/l,2025-10-12T22:01:47.138146Z
Bunthaus,12.10.2025 15:50,Chlorophyll Grünalgen,23.4,µg/l,2025-10-12T22:01:47.138146Z
Bunthaus,12.10.2025 15:50,Chlorophyll (gesamt),48.1,µg/l,2025-10-12T22:01:47.138146Z
Bunthaus,12.10.2025 16:00,Sauerstoffkonzentration,10.2,mg/l,2025-10-12T22:01:47.138146Z
Bunthaus,12.10.2025 16:00,Trübung,13.5,FNU,2025-10-12T22:01:47.138146Z
Bunthaus,12.10.2025 16:00,pH-Wert,7.9,ohne,2025-10-12T22:01:47.138146Z
Bunthaus,12.10.2025 16:00,Wassertemperatur,13.7,°C,2025-10-12T22:01:47.138146Z
Bunthaus,12.10.2025 16:00,Sauerstoffsättigung,99.1,%,2025-10-12T22:01:47.138146Z
Blankenese,12.10.2025 16:00,Sauerstoffsättigung,67.7,%,2025-10-12T22:01:48.205534Z
Blankenese,12.10.2025 16:00,pH-Wert,7.8,ohne,2025-10-12T22:01:48.205534Z
Blankenese,12.10.2025 16:00,Sauerstoffkonzentration,6.9,mg/l,2025-10-12T22:01:48.205534Z
Blankenese,12.10.2025 16:00,Trübung,39.6,FNU,2025-10-12T22:01:48.205534Z
Blankenese,12.10.2025 16:00,Wassertemperatur,14.0,°C,2025-10-12T22:01:48.205534Z
Bunthaus,12.10.2025 15:50,Chlorophyll Kieselalgen,19.6,µg/l,2025-10-13T01:01:13.178493Z
Bunthaus,12.10.2025 15:50,Chlorophyll Grünalgen,23.4,µg/l,2025-10-13T01:01:13.178493Z
Bunthaus,12.10.2025 15:50,Chlorophyll (gesamt),48.1,µg/l,2025-10-13T01:01:13.178493Z
Bunthaus,12.10.2025 16:00,Sauerstoffkonzentration,10.2,mg/l,2025-10-13T01:01:13.178493Z
Bunthaus,12.10.2025 16:00,Trübung,13.5,FNU,2025-10-13T01:01:13.178493Z
Bunthaus,12.10.2025 16:00,pH-Wert,7.9,ohne,2025-10-13T01:01:13.178493Z
Bunthaus,12.10.2025 16:00,Wassertemperatur,13.7,°C,2025-10-13T01:01:13.178493Z
Bunthaus,12.10.2025 16:00,Sauerstoffsättigung,99.1,%,2025-10-13T01:01:13.178493Z
Blankenese,12.10.2025 16:00,Sauerstoffsättigung,67.7,%,2025-10-13T01:01:14.199845Z
Blankenese,12.10.2025 16:00,pH-Wert,7.8,ohne,2025-10-13T01:01:14.199845Z
Blankenese,12.10.2025 16:00,Sauerstoffkonzentration,6.9,mg/l,2025-10-13T01:01:14.199845Z
Blankenese,12.10.2025 16:00,Trübung,39.6,FNU,2025-10-13T01:01:14.199845Z
Blankenese,12.10.2025 16:00,Wassertemperatur,14.0,°C,2025-10-13T01:01:14.199845Z
Bunthaus,12.10.2025 15:50,Chlorophyll Kieselalgen,19.6,µg/l,2025-10-13T04:01:00.345887Z
Bunthaus,12.10.2025 15:50,Chlorophyll Grünalgen,23.4,µg/l,2025-10-13T04:01:00.345887Z
Bunthaus,12.10.2025 15:50,Chlorophyll (gesamt),48.1,µg/l,2025-10-13T04:01:00.345887Z
Bunthaus,12.10.2025 16:00,Sauerstoffkonzentration,10.2,mg/l,2025-10-13T04:01:00.345887Z
Bunthaus,12.10.2025 16:00,Trübung,13.5,FNU,2025-10-13T04:01:00.345887Z
Bunthaus,12.10.2025 16:00,pH-Wert,7.9,ohne,2025-10-13T04:01:00.345887Z
Bunthaus,12.10.2025 16:00,Wassertemperatur,13.7,°C,2025-10-13T04:01:00.345887Z
Bunthaus,12.10.2025 16:00,Sauerstoffsättigung,99.1,%,2025-10-13T04:01:00.345887Z
Blankenese,12.10.2025 16:00,Sauerstoffsättigung,67.7,%,2025-10-13T04:01:01.844715Z
Blankenese,12.10.2025 16:00,pH-Wert,7.8,ohne,2025-10-13T04:01:01.844715Z
Blankenese,12.10.2025 16:00,Sauerstoffkonzentration,6.9,mg/l,2025-10-13T04:01:01.844715Z
Blankenese,12.10.2025 16:00,Trübung,39.6,FNU,2025-10-13T04:01:01.844715Z
Blankenese,12.10.2025 16:00,Wassertemperatur,14.0,°C,2025-10-13T04:01:01.844715Z
Bunthaus,13.10.2025 06:10,Chlorophyll (gesamt),42.6,µg/l,2025-10-13T07:01:08.734444Z
Bunthaus,13.10.2025 06:10,Chlorophyll Kieselalgen,17.4,µg/l,2025-10-13T07:01:08.734444Z
Bunthaus,13.10.2025 06:10,Chlorophyll Grünalgen,20.7,µg/l,2025-10-13T07:01:08.734444Z
Bunthaus,13.10.2025 07:00,Sauerstoffkonzentration,10.1,mg/l,2025-10-13T07:01:08.734444Z
Bunthaus,13.10.2025 07:00,Trübung,10.6,FNU,2025-10-13T07:01:08.734444Z
Bunthaus,13.10.2025 07:00,pH-Wert,7.9,ohne,2025-10-13T07:01:08.734444Z
Bunthaus,13.10.2025 07:00,Wassertemperatur,13.6,°C,2025-10-13T07:01:08.734444Z
Bunthaus,13.10.2025 07:00,Sauerstoffsättigung,97.1,%,2025-10-13T07:01:08.734444Z
Blankenese,13.10.2025 07:00,Sauerstoffkonzentration,6.7,mg/l,2025-10-13T07:01:09.735366Z
Blankenese,13.10.2025 07:00,Trübung,67.1,FNU,2025-10-13T07:01:09.735366Z
Blankenese,13.10.2025 07:00,pH-Wert,7.7,ohne,2025-10-13T07:01:09.735366Z
Blankenese,13.10.2025 07:00,Wassertemperatur,14.1,°C,2025-10-13T07:01:09.735366Z
Blankenese,13.10.2025 07:00,Sauerstoffsättigung,65.4,%,2025-10-13T07:01:09.735366Z
Bunthaus,13.10.2025 11:40,Chlorophyll (gesamt),38.0,µg/l,2025-10-13T10:20:22.030625Z
Bunthaus,13.10.2025 11:40,Chlorophyll Grünalgen,19.7,µg/l,2025-10-13T10:20:22.030625Z
